created_utc,title,author,score,text,url,image_url,permalink
2025-04-05 04:32:31,Invest in a Roth now for 2024 tax year or just sit out and wait for it to drop lower?,No-Sea-9287,0,"So, I have the opportunity to max out 2024 Roth IRAs  because I haven't hit the submit button on the tax app. 

I wonder if we would be better off sitting out investing right now in a Roth with Edward Jones and just hold on to my 7k for mine and another 7k for my partner? 

We have a pretty good interest rate on our mortgage. So paying that down makes no sense. 

I know you can't time the market, but I also feel like very bad news bears is coming and this is just the tip.  

Anxiety is real.

You Ain't Seen Nothin' Yet
Song by Bachman–Turner Overdrive








",https://www.reddit.com/r/investing/comments/1jrvfaa/invest_in_a_roth_now_for_2024_tax_year_or_just/,,https://www.reddit.com/r/investing/comments/1jrvfaa/invest_in_a_roth_now_for_2024_tax_year_or_just/
2025-04-05 03:46:07,Is this wealth building time?,naturalhairtingz,63,"If I increase my DCA (dollar-cost averaging) and commit to riding this out for the next couple of years, is this one of those real wealth-building windows?

I started investing later than I wanted to, but I’m ready to stay consistent and focus long-term. Just wondering if this is one of those times where you can not only build real gains but also catch up if you’re behind.

Would love to hear from those who’ve been through similar market cycles—does this feel like a time to double down and stay patient?",https://www.reddit.com/r/investing/comments/1jrumx6/is_this_wealth_building_time/,,https://www.reddit.com/r/investing/comments/1jrumx6/is_this_wealth_building_time/
2025-04-05 03:11:47,"For those of you holding Real Estate, how are you doing?",Vegetable_Help_5932,1,"For those holding a Real Estate portfolio, how are you doing?

* Lots of people are holding cheap mortgage debt (2-3%, 30 year fixed) and rental properties.  
* This debt is effectively shorting the dollar,  
* RE is a hedge against inflation the cost of debt service goes down in an inflationary environment 

",https://www.reddit.com/r/investing/comments/1jru1fo/for_those_of_you_holding_real_estate_how_are_you/,,https://www.reddit.com/r/investing/comments/1jru1fo/for_those_of_you_holding_real_estate_how_are_you/
2025-04-05 02:55:19,"TikTok deal put on hold after China objects over tariffs, sources say",MolassesCalm4876,83,"WASHINGTON/BEIJING, April 4 (Reuters) - A deal to spin off the U.S. assets of TikTok was put on hold after China indicated it would not approve the deal following President Donald Trump's tariffs announcement this week, according to two sources familiar with the matter.

Trump on Friday extended by 75 days a deadline for ByteDance to sell U.S. assets of the popular short video app to a non-Chinese buyer, or face a ban that was supposed to have taken effect in January under a 2024 law.

https://www.reuters.com/markets/deals/trump-tiktok-sale-deadline-looms-us-looks-deal-2025-04-04",https://www.reddit.com/r/investing/comments/1jrtr36/tiktok_deal_put_on_hold_after_china_objects_over/,,https://www.reddit.com/r/investing/comments/1jrtr36/tiktok_deal_put_on_hold_after_china_objects_over/
2025-04-05 01:59:54,Why wouldn’t I sell everything right now until it stabilizes?,feel-electric,0,"I just started investing a couple months ago, so bear with me.

What is the actual benefit of me leaving my money in my Roth right now? Wouldn’t it make sense to sell it all, and then reinvest once things get a little better? Why does it make sense to just sit back and lose all of my money, even though I know it will increase in 20+ years.

If I pull the funds now, I’ll still be ahead more than if I don’t, right?

I know I’m not supposed to look at my Roth like that, but even if I just sell my holdings and keep the money in the account, liquid, it feels safer ",https://www.reddit.com/r/investing/comments/1jrsr1u/why_wouldnt_i_sell_everything_right_now_until_it/,,https://www.reddit.com/r/investing/comments/1jrsr1u/why_wouldnt_i_sell_everything_right_now_until_it/
2025-04-05 01:57:30,Investing direction for cash sitting on sidelines,microwavesafe1,2,"Hello,

Things have been going absolute bonkers..My story..Had about 520k in 401k out of which 400k was in income accounts..Have been out of the market and missed out on all the gains since 2022..Now this downturn gave me a slight better entry..was thinking about just putting all 400k back in Feb because had no clue when the market would stop going up which I am glad I did not.

I put about 200k back in the market today all sp500 index since have no clue how much it will go down. I still have about 200k left in 401k and about 200k in personal cash to invest.

Before all this happened back in Feb an intro plan with vanguard advisor he told me to be 85% stocks and 15%bonds. He had my portfolio as 55% VTI..30% vxus and 15%and.

My question if you had this money what would u do..just wait for more downtrend or start dca or buy particular etf and call it a day..I wont need this money for next 20 years..have 100k in emergency savings",https://www.reddit.com/r/investing/comments/1jrspfi/investing_direction_for_cash_sitting_on_sidelines/,,https://www.reddit.com/r/investing/comments/1jrspfi/investing_direction_for_cash_sitting_on_sidelines/
2025-04-05 01:54:51,Should I keep my money in my Fidelity brokerage account?,JJSSteury,0,"First of all, I know very little about investing, so I may say things that don't make sense lol

I'm 20 years old, I have a brokerage account that I invested $20,000 into, and a roth IRA in which I've invested $14,000. For the brokerage account, I've invested 20% into FTIHX, and the rest into FSKAX. The market has been red lately, so I'm wondering if I should take this money out of the brokerage account, and reinvest it if it goes down further, or just leave it in there, and or invest more?

Also, is there anything I should be doing differently? Any tips would be appreciated! :)",https://www.reddit.com/r/investing/comments/1jrsnp6/should_i_keep_my_money_in_my_fidelity_brokerage/,,https://www.reddit.com/r/investing/comments/1jrsnp6/should_i_keep_my_money_in_my_fidelity_brokerage/
2025-04-05 01:48:48,U.S. stocks see biggest 2-day wipeout in history as market loses $11 trillion since Inauguration Day,dukerustfield,2313,"I didn’t know it was this bad. We get best ever and most evers all the time. Inflation tends to make that possible. Some Black Monday in 1805 might have lost $700 and 3 donkeys and it stands as some colossal reversal of fortune.

But we’ve posted a lot of the record breaking on the positive side. Or at least I have. Only fair we show this.

https://www.marketwatch.com/story/u-s-stocks-poised-for-biggest-two-day-wipeout-in-history-as-marketloses-9-6-trillion-since-inauguration-day-430919f6?&g=2bf9a483-7e6f-461a-a1f9-76fa2fe7b299&mod=djem_mwnbulletin

> Roughly $11.1 trillion has been wiped away from the U.S. stock market since Jan. 17, the Friday before President Donald Trump took the oath of office and began his second term, according to data from Dow Jones Market Data.

> Some $6.6 trillion of that figure was lost on Thursday and Friday alone — the largest two-day wipeout of shareholder value on record, Dow Jones data showed.

> By the time the market closed on Friday, the S&P 500 had surpassed its losses from the first 75 days of George W. Bush’s first term in office — the last time stocks saw comparable declines during the early days of a new administration. The small-cap-focused Russell 2000 has seen its rockiest start to a new administration on record, FactSet data showed.

Can’t believe we’d be looking back with rosy eyes toward George W. The article is especially concerned where we enter a trade war(s) and “don’t back down.”

I don’t think anyone anticipated how bad this would get and how fast. But the market can change on a dime. Provided there is a letup on pressure. But how the hell are businesses supposed to plan and build out? Everyone is sitting on cash because they don’t know if they’ll need it just to stay afloat. 

And this administration seems incapable of admitting mistake. They got plenty of experts to blame if they want scapegoats. I just don’t know they’ll reverse course. If they do, will it be fast enough to matter?",https://www.reddit.com/r/investing/comments/1jrsjqm/us_stocks_see_biggest_2day_wipeout_in_history_as/,,https://www.reddit.com/r/investing/comments/1jrsjqm/us_stocks_see_biggest_2day_wipeout_in_history_as/
2025-04-05 01:29:08,How Do I Invest? I Am Starting Out. Need Advice.,kubjab,0,"Say I have 80,000 dollars in a high yield savings account right now (3.7%) and I have no investments anywhere else. Yes, this is separate from my emergency savings. I’m looking to get into investing and feel like now is the time to jump in. 

With everything that you now know, if you were to start investing on Monday, April 7th, how would you do it? 

Looking to be reasonably safe with my money. 

How would you diversify? 60/40 stocks/bonds? 50/30/20 stocks, bonds, private assets?

Please pretend the 80,000 is yours… how would you divi it up into each investment? Would you buy ETFs, would you buy mutual funds, would you buy bonds? And then which ones would you buy? 

Realistically, what is the smartest thing to do when the market is “crashing”?

Thanks all. Really appreciate your time. 

Edit: After reading the replies and doing a bit more research, I’m thinking of going either 55% VOO + 30% VXUS + 15% VXF or 70% VTI + 30% VXUS. ",https://www.reddit.com/r/investing/comments/1jrs6qx/how_do_i_invest_i_am_starting_out_need_advice/,,https://www.reddit.com/r/investing/comments/1jrs6qx/how_do_i_invest_i_am_starting_out_need_advice/
2025-04-05 01:22:24,Anyone Get IRS Audited over K1s for Master Limited Partnerships?,Ok_Atmosphere3601,0,"So I bought a lot of MLPs in 2020 (about 20) and they are all going great despite the recent hiccup.

But its K1 time now and I wonder how dilligent I have to be entering all the information into Turbo Tax. I don't even quite understand how it's used.   
  
As I understand it, the unit distributions are of course tax deferred so it does matter to accurate disclose by basis and sales price so the recaptured tax can be calculated accurately. 

But does entering out what was in Box 8, 12, and all those Z's in box 20 really matter? Will I get audited over it.",https://www.reddit.com/r/investing/comments/1jrs285/anyone_get_irs_audited_over_k1s_for_master/,,https://www.reddit.com/r/investing/comments/1jrs285/anyone_get_irs_audited_over_k1s_for_master/
2025-04-05 00:47:25,"""This time is different"" NO ITS NOT",nharKdivaD,0,"In the last week, I have seen countless posts of people panicking about their portfolios, asking internet strangers if they are doomed, or seeing if others are panic selling so they can justify doing the same. When markets are going up, investing is EASY: You buy VOO and chill—at least that's what people on this app do. When we see a correction, everyone starts losing their minds. The reality is that investing HAS been figured out. You buy low-cost, globally diversified ETFs and wait. Hold through the good times and wait through the bad times. The truth is that a lot of you can't do it. There is a reason why retail has vastly underperformed the S&P 500 over the last 20 years... even though we have seen maybe the greatest bull run in the history of the world. People here love telling others that a financial advisor is a huge waste of money. Guess what, advisors outperform retail investors by over 2% annualized WITH a 1% advisory fee. That 1% fee does compound to a ridiculous amount of money over multiple decades, but who cares, you are gonna panic sell anyway and then FOMO back in when there's a bounce. 

STAY THE COURSE. Fund managers get paid millions, literally millions of dollars every year attempting to outperform the S&P 500... and they are unable to do it. Keep buying low-cost, broadly diversified ETFs. Or hire an advisor who also invests in low-cost ETFs for their clients. STOP SABOTAGING YOUR RETURNS. 

Keep DCAing, keep contributing to your IRAs, and focus on your life outside of your brokerage account. Good luck!",https://www.reddit.com/r/investing/comments/1jrrej7/this_time_is_different_no_its_not/,,https://www.reddit.com/r/investing/comments/1jrrej7/this_time_is_different_no_its_not/
2025-04-05 00:25:49,Rocket Lab (RKLB): A Promising Space Stock for the Post-Musk Era,cheese_and_toasted,1,"Elon Musk’s ventures have long dominated “space investing” conversations – but with Musk’s recent controversies and the fact that SpaceX isn’t publicly traded, investors are turning toward Rocket Lab as an attractive alternative. Rocket Lab (RKLB) is a \~$10–11B market cap space company that offers something SpaceX doesn’t: public market access to a growing space business, minus the Musk-related volatility. Let’s break down why RKLB might deserve a spot in a forward-looking portfolio:

* Robust Growth Trajectory: Rocket Lab’s financials showcase a company on the rise. 2024 revenues hit $436M (+78% YoY) , and Q4 alone grew 121% YoY. They’ve consistently increased launch count (16 launches in 2024 vs 10 in 2023) and expanded their Space Systems segment (which now brings in \~two-thirds of revenue via satellite manufacturing and components). Gross margins are improving (32% non-GAAP in 2024) , pointing to economies of scale. While the company is not net profitable yet (as it reinvests in growth), Wall Street expects continued top-line expansion and eventual operating leverage as larger projects come online .
* Catalysts on the Horizon: The big one is Neutron, Rocket Lab’s next-gen reusable rocket aimed at the medium-lift market. Management has scheduled the first launch for H2 2025 . This could be a game-changer – Neutron is designed to lift up to 13 tons to LEO , putting Rocket Lab in direct competition with SpaceX’s Falcon 9 for many satellite launch contracts. If successful, Neutron opens a much larger addressable market (national security launches, interplanetary missions, even crewed flights eventually). Investors are watching this closely; any positive development (engine tests, on-time construction) could boost the stock. In the meantime, Rocket Lab isn’t waiting around: they’ve signed new launch deals (e.g. an 8-launch contract with Japan’s iQPS just announced) , and they delivered on missions like launching 8 satellites for OroraTech with just 4 months’ turnaround , showcasing operational excellence.
* Government and Commercial Tailwinds: Unlike many space SPACs and startups that struggled, Rocket Lab has real customers and repeat business. Their backlog is \~$1.1B , split \~50/50 between government and commercial clients – providing diversification. Notably, Rocket Lab was selected for the U.S. Space Force’s NSSL Phase 3 (Lane 1) program , making them eligible for missions under a $5.6B launch contract umbrella alongside incumbents like SpaceX and ULA. They also hold a $515M contract with the Space Development Agency (SDA) to build missile-tracking satellite systems . These wins not only validate Rocket Lab’s technology in the eyes of key customers, but also ensure a baseline of revenue in coming years. In essence, Rocket Lab is aligning itself as a core player in future government space infrastructure – a recurring revenue stream that many “new space” companies lack.
* Musk Factor – or Lack Thereof: From an investing standpoint, one could argue that Musk has become a risk factor. Tesla’s own 10-K warned that the brand is tied to Musk’s reputation , and indeed we’ve seen political backlash contribute to Tesla’s sales slump and stock drop . SpaceX, while successful, is privately funded and also influenced by Musk’s persona (which might carry regulatory or public image risks, given his role in government and polarizing public statements). Rocket Lab provides a “Musk-free” exposure to the space sector. CEO Peter Beck is an engineer-executive who keeps a lower profile. There’s no cult of personality driving Rocket Lab’s valuation – which means less idiosyncratic risk. In fact, Rocket Lab’s shares are more directly correlated with its execution (launch success, contracts, revenue) than with any social media narrative. For an investor, that can be reassuring.

Valuation Considerations: After the recent pullback, RKLB trades at a more reasonable multiple relative to its growth. It had skyrocketed over 400% in the past year , but is now off highs. Analysts still see upside: Cantor Fitzgerald recently reaffirmed an Overweight with a $24 target , and other targets range up to $33 . Clearly, expectations are that Rocket Lab will continue to scale and eventually approach profitability as Neutron comes into service. Risks include execution delays (a short-seller argued Neutron could be late to 2026 , which would slow revenue growth) and competition (SpaceX’s dominance, emerging players like Blue Origin). However, Rocket Lab’s head start in small launch and established customer base give it a moat in its niche. Its enterprise value ($11B) is a fraction of SpaceX’s ($140B private valuation), so investors are essentially betting that Rocket Lab can capture even a small slice of SpaceX’s market share in the coming years – which would justify significant upside.

Conclusion: If you’re disillusioned with Musk or simply want a piece of the space sector’s growth, Rocket Lab is one of the most compelling options available. It combines the innovation of New Space with the accountability of a public company. As always, invest based on your due diligence (space is a risky industry), but RKLB offers a balanced risk-reward profile: solid current business, big future bets, and freedom from the Elon factor. For many, that’s an attractive proposition in 2025 and beyond.

",https://www.reddit.com/r/investing/comments/1jrqzht/rocket_lab_rklb_a_promising_space_stock_for_the/,,https://www.reddit.com/r/investing/comments/1jrqzht/rocket_lab_rklb_a_promising_space_stock_for_the/
2025-04-05 00:09:30,When are you buying the dip?,ukrinsky555,181,"Many people who are sitting on cash will say ""I am going to buy the dip."" What is the criteria for you to buy the dip with excess cash if you are fortunate enough to be in a position to do so?

For me the VIX needs to be under 20 and there has to be some sort of resolution to the current trade wars.  Example.  Market falls another 10% Trump comes out and revises to a blanket 5-10% Tariff.  I could live with that.  Or things get so bad Jerome Powell has to do an emergency broadcast ( Stimulus. ) That would be my all in cue.",https://www.reddit.com/r/investing/comments/1jrqnte/when_are_you_buying_the_dip/,,https://www.reddit.com/r/investing/comments/1jrqnte/when_are_you_buying_the_dip/
2025-04-04 23:37:08,Buying the Dip? DCA or crystal Ball?,EntrepreneurFun2421,0,"The market has just endured its worst two day stretch since the COVID crash, and fear is gripping investors. The VIX, is at 46 “fear gauge,” is at 6, For context, during the peak of the COVID-19 pandemic in March 2020, fear was a 9 

Historically, when the VIX exceeds 25, it often signals prime buying opportunities. In fact, every instance of the VIX surpassing this threshold has been followed by significant market rebounds.

All the negative factors projected tariffs, absence of deals, and lack of tax cuts are currently being priced into the market. None of these have materialized yet. Similarly, no positive developments have occurred, except for the trillions of investments flowing into our country. Any hint of a deal or policy shift could ignite a strong rally.

I’m no market oracle, so I’m taking a measured approach by DCA into positions. And anyone here who claims to be one is mistaken because the future is uncertain. Notably, two prominent hedge fund managers initiated new positions in NVDA today. Why? Because, despite the unpredictability of policy decisions, they recognize the value in NVDA at $100. Reflecting on 2022, we experienced several dead cat bounces until the bottom was reached in October.

Reviewing my purchases from 2022: ￼
	•	1/24: 50 shares at $393
	•	2/4: 10 shares at $409
	•	3/8: 5 shares at $383
	•	5/23: 20 shares at $360
	•	8/2: 5 shares at $374
	•	9/13: 10 shares at $361
	•	10/17: 10 shares at $335
	•	12/7: 4 shares at $361

As you can see, I was down pretty bad all year but remained consistent. I own four ETFs, and even if this market declines another 90%, I will still be okay.

Remember, the best opportunities often arise when fear peaks. While others hesitate, this could be the moment to consider buying. Markets have a history of rebounding, and those who act decisively during downturns often reap the rewards.",https://www.reddit.com/r/investing/comments/1jrq0dn/buying_the_dip_dca_or_crystal_ball/,,https://www.reddit.com/r/investing/comments/1jrq0dn/buying_the_dip_dca_or_crystal_ball/
2025-04-04 23:34:26,Worried about investments,Fun-Ad-5784,0,"My investments have dropped and I'm concerned about losing more money. I invested about 6 years ago and it dropped initially but I left it and over time it finally got back to baseline (no poss but no gain). Last year is the first year I saw some profit. I was happy and hoped it would slowly grow for retirement. Now it's dropped and I'm worried it will get worse. I'm wondering if i should put it into very low risk so it doesn't grow but doesn't shrink or if I should pull it and leave it in the bank until things improve. 

Yes things will eventually get better but what if it takes 10 years? The money will drop and when it finally starts to grow it will have to recoup all that lost money just to break even and that could take years. I'd rather leave it safe and not get gains rather than lose money.

Thoughts? The next 4 years are gonna suck.",https://www.reddit.com/r/investing/comments/1jrpydm/worried_about_investments/,,https://www.reddit.com/r/investing/comments/1jrpydm/worried_about_investments/
2025-04-04 22:39:42,Does it make sense to use money market funds as a savings account?,IndigoBlue24,2,"Was looking at moving my savings and a CD I own to TMCXX. I live in PA if that matters for tax reasons.

I haven’t purchased a money market fund before so a little new to this. I do need access to these funds in an emergency. Is there any down side to doing this? Currently my flexible CD is only giving me 3.4%.",https://www.reddit.com/r/investing/comments/1jrosv7/does_it_make_sense_to_use_money_market_funds_as_a/,,https://www.reddit.com/r/investing/comments/1jrosv7/does_it_make_sense_to_use_money_market_funds_as_a/
2025-04-04 22:27:04,"Helping father-in-law out with investments, seeking advice.",baconeggdheese,0,"I’m currently trying to help guide my father-in-law with his investment strategy. Since we’re at very different stages in life, I realize his approach shouldn’t mirror mine. I’m 24 and focused on long-term growth, so my portfolio is heavily weighted in VOO, QQQ, VTSAX, and some individual blue-chip stocks. He, on the other hand, is 58 years old with around $35,000 to invest (he has other investments as well) and he is planning to retire within the next 5-7 years. He doesn’t want to leave the money sitting in a savings account, but I’m unsure of the best approach for someone his age—especially with today’s economic uncertainty. I’d love any advice on how he should consider investing this money, given his timeframe and risk tolerance.   
  
Thank you in advance",https://www.reddit.com/r/investing/comments/1jroj6k/helping_fatherinlaw_out_with_investments_seeking/,,https://www.reddit.com/r/investing/comments/1jroj6k/helping_fatherinlaw_out_with_investments_seeking/
2025-04-04 21:55:06,Rate cut or not? Powell says Fed will wait before further rate moves,Faceouster,48,"What do you think about Powell latest stance?

Do you think a rate cut is still coming in May/June/July?

[https://www.cnbc.com/2025/04/04/powell-sees-tariffs-raising-inflation-and-says-fed-will-wait-before-further-rate-moves.html](https://www.cnbc.com/2025/04/04/powell-sees-tariffs-raising-inflation-and-says-fed-will-wait-before-further-rate-moves.html)",https://www.reddit.com/r/investing/comments/1jrntnx/rate_cut_or_not_powell_says_fed_will_wait_before/,,https://www.reddit.com/r/investing/comments/1jrntnx/rate_cut_or_not_powell_says_fed_will_wait_before/
