created_utc,title,author,score,text,url,image_url,permalink
2025-04-10 19:21:12,FZDXX question for future house down payment,InvestmentAdvice2024,1,"I am looking for feedback or thoughts on what you might do in my situation.

I have about 250K in FZDXX which is being saved for a house down payment, I was hoping it would be this year but as I work remote and can’t transfer my job I might have to wait a few years closer to retirement.

Is it safe to keep it in FZDXX in the current financial market or should I position this somewhere else in Fidelity?

Thanks in advance for any investment advice.",https://www.reddit.com/r/investing/comments/1jw6a8r/fzdxx_question_for_future_house_down_payment/,,https://www.reddit.com/r/investing/comments/1jw6a8r/fzdxx_question_for_future_house_down_payment/
2025-04-10 19:08:38,Anyone else adjust their investing strategies?,dezahpp,1,"Ever since Trump took office, I've lost a bunch of confidence in the US market. I've shifted over my 403b retirement investment strategies to be 100% international funds. I just feel that I won't need to be constantly worried and shook about every single Trump news headline that comes up daily. I mean I still do since whatever happens in the US still affects the global market but at least I have a little more of peace of mind and then I'll see how everything plays out after a few months to see if I will need to adjust my strategies again. I was kind of doubting my change and shift in investing the other day but felt validated today as I am back in the green and everyone else that I know are still in the red with their retirement accounts. It just feels like international markets are a much more stable place for investments as US market is too volatile and unpredictable right now. It feels like it's turned into a meme crypto market like Solana lol.

I don't have the mental fortitude to deal with all of these daily Trump changes and headlines so I'll just stay away for a bit even though everyone keeps saying just buy the dip. Plus I'm out here just trying to survive buying groceries and paying rent for my family while everything is constantly getting more expensive so I don't have the disposal income like some of you guys are reporting in here lol.

Have you guys also differentiated your investment strategies and what are you guys doing?",https://www.reddit.com/r/investing/comments/1jw5zn2/anyone_else_adjust_their_investing_strategies/,,https://www.reddit.com/r/investing/comments/1jw5zn2/anyone_else_adjust_their_investing_strategies/
2025-04-10 18:44:04,Final-Lock789 SCAM sigh... I was so excited,username48378645,0,"Oh man, I'm so disappointed. I thought I've finally found an angel investor and it turns out he's a scammer.

Here's how I know:

""Final-Lock789"" has 0 posts and 0 karma, his account is less than 60 days old, and he doesn't want to use PayPal, Stripe, or any other alternative, because it is ""Tied to his business"".  We MUST use Venmo, CashApp, or Crypto.

And of course, I must send him 3% of loss pool before he sends me the money.

Not only that, I've found [this post](https://www.reddit.com/r/Entrepreneur/comments/1ill4xh/comment/mbvn26x/?utm_source=share&utm_medium=web3x&utm_name=web3xcss&utm_term=1&utm_content=share_button) about a different scammer, that just like *Final-Lock789* is from Texas, can only use Venmo, CashApp, or Crypto, and also asked for 3% loss pool.

In the post linked, OP said he dodged a bullet.

Anyway, I'm making this post in the hopes it ranks on Google, since when I've searched for ""Final-Lock789 scam reddit"" nothing showed up.

If you're reading this, don't fall for his scam. The worst part is learning I don't have the investor I thought I did.

Well, lesson learned I guess...",https://www.reddit.com/r/investing/comments/1jw5ei9/finallock789_scam_sigh_i_was_so_excited/,,https://www.reddit.com/r/investing/comments/1jw5ei9/finallock789_scam_sigh_i_was_so_excited/
2025-04-10 18:38:28,Looking to get back in eventually... But when?,jonwb1,0,"Hi... Before my SWTSX Index Fund lost half its gains, I sold it. Kinda wish I hadn't now because it rebounded fairly well. I have 100k in cash and want to get back in eventually (probably with an S&P fund).

When do think it'd be best to reinvest the proceeds?  Second quarter earnings?, 90-day Tariff takeover?, World War III? Seriously, I'm in no rush here, but I figure more of you are in tune with what's happening economically than I am, and I'd like your opinions.

Thanks

",https://www.reddit.com/r/investing/comments/1jw59pt/looking_to_get_back_in_eventually_but_when/,,https://www.reddit.com/r/investing/comments/1jw59pt/looking_to_get_back_in_eventually_but_when/
2025-04-10 18:31:15,How the hell are people saying their 401k are almost entirely wiped out after this dip? What are these people invested in?,Over-Concern3522,149,"I’ve been seeing so much fear across the board and people acting like their 401ks are completely gone after the last week. What are these people talking about? My 401k is down sure, but wiped out completely? Not even close. 

Then I see people saying they should’ve taken all the money out and people asking if they still should take the money out to keep it safe… has this latest crash just revealed that the average person has absolutely no idea what they’re talking about or is my 401k just purely bonds and I didn’t know for the last 10 years lmao. 

Edit: I’m talking about younger people saying this. If you’re old/close to retirement it’s obviously a much more dire circumstance for you.  ",https://www.reddit.com/r/investing/comments/1jw53e4/how_the_hell_are_people_saying_their_401k_are/,,https://www.reddit.com/r/investing/comments/1jw53e4/how_the_hell_are_people_saying_their_401k_are/
2025-04-10 18:22:15,Swiss Franc - how high can it go?,big-papito,3,"Boy, am I glad I peaced out of this shitshow into FXF and FXE, and it looks like the money is flowing out of the Dollar and into... the Swiss Franc? It's up 4% against USD just today. Extremely sharp movement, historically.

Is it possible that it's becoming the safety haven currency?",https://www.reddit.com/r/investing/comments/1jw4vld/swiss_franc_how_high_can_it_go/,,https://www.reddit.com/r/investing/comments/1jw4vld/swiss_franc_how_high_can_it_go/
2025-04-10 17:28:55,Exit strategy for safe investment?,CheffingwPraxis,0,"Dunno how the rest of y'all are doing but I'm staring at total valuation down 35% in the last month. Wiped out my bags over the past two years and then some. Probably just too slow to take the small hit and sell before it got this bad. Mostly investing in small industrial, ESG and a couple F500 stocks with some cash in crypto (rofl kill me). Trying to think of safe exits to stem the bleeding with a goal of converting to cash, bonds & European stock if I can recover some losses.

Anyone else looking at a similar situation? What are some solutions you've come up with? Or are we all just holding on for dear life and waiting for a recovery in four years?",https://www.reddit.com/r/investing/comments/1jw3ki9/exit_strategy_for_safe_investment/,,https://www.reddit.com/r/investing/comments/1jw3ki9/exit_strategy_for_safe_investment/
2025-04-10 17:27:00,"Honest question: Those of you who are not panicking, but buying right now, how do you have the cash available to do that?",roknzj,0,"I see a lot of people bragging about being long term investors, and not panicking, and trust the market, and that they're: ""Buying right now!"" What cash are you using? Your words make it sound like you're pushing all your chips in on a once in a lifetime moment, but I doubt that's the case. If it were, then how were you so heavy in cash in the first place? How did you build up your cash stockpile as opposed to investing sooner if time is best spent in the market? Are you heavily into dividends that you let pile up? Or are you simply stating that you're continuing your weekly paycheck investing? What is it?

I'm not trying to pick fights, I'm honestly curious. I've always been a fully invested person. I'm almost always around 98% invested. I recently, since March 7, freed up about 10% of my portfolio thinking I might have a better opportunity to pick up bargains at a later date. I sold stocks I had lost faith in (Disney, Starbucks, Airbnb, etc). I like to think of myself as a long term investor, but reading comments on here it makes me feel like I'm panicking. So I'm just looking for some honest answers.

  
Thanks.",https://www.reddit.com/r/investing/comments/1jw3irg/honest_question_those_of_you_who_are_not/,,https://www.reddit.com/r/investing/comments/1jw3irg/honest_question_those_of_you_who_are_not/
2025-04-10 16:46:57,Why are people vehemently against buying and holding currently also citing Warren Buffet?,Nosemyfart,48,"I'm fairly certain Buffet himself advises against timing the market. 

A lot of comments go like - ""I sold, I'll get back in when Buffet does"". But, you just went against what he wants the average investor to do. 

Does the average redditor think they are above average investors?",https://www.reddit.com/r/investing/comments/1jw2jsu/why_are_people_vehemently_against_buying_and/,,https://www.reddit.com/r/investing/comments/1jw2jsu/why_are_people_vehemently_against_buying_and/
2025-04-10 16:38:18,General question about contributions,Kooky-Accident-6787,2,Hello everybody I have a general question about IRAs. In 2024 I have made some contributions into my Roth IRA to the amount of 2825$ and I made some contributions into my traditional IRA in the amount of 1000$. I am currently a third year resident making maybe around 60-65 k at most this year. I will be finishing my training by July 1st. I will be starting work as a physician in September of this year and will make around 300k salary . I am married and filed jointly on my previous tax returns my question is can I still contribute to my Roth IRA for the 2025 year or should I contribute to my 2024 year without getting penalties? ,https://www.reddit.com/r/investing/comments/1jw2cbu/general_question_about_contributions/,,https://www.reddit.com/r/investing/comments/1jw2cbu/general_question_about_contributions/
2025-04-10 15:51:19,There is no way US equities can outperform international over the next decade,Tiny-Pomegranate7662,0,"It's basic fundamental analysis that says international equity, pretty much every other country actually, has better price ratios relative to current earnings / cash flow / sales etc... So, investors currently believe that the US has the ability to outperform all other countries over the next decade.

That is a horrible assumption. For starters most all of the other countries already fought with their demons a couple years ago, EU with an actively invading Russia, China with a property bubble collapse that's basically done now etc... The US never hit any pain from COVID cause it debt funded its way through. Now our gov't interest rates are worse than Greece. That macro factor alone, coupled with all the tariff crap, a dwindling AI profitability prospect (why are they cancelling all their data center leases), an imploding EV scene...

Who on earth would think the US has 'better' odds than somewhere like South Africa?",https://www.reddit.com/r/investing/comments/1jw18ab/there_is_no_way_us_equities_can_outperform/,,https://www.reddit.com/r/investing/comments/1jw18ab/there_is_no_way_us_equities_can_outperform/
2025-04-10 15:41:24,Desktop Stock Alert app... Paid or Free,jonwb1,0,"I did a search on this but most posts are 7 to 10 yrs old. I'd like to find a easy to install stock alert app that'll notify me when a stock or ETF goes below a certain threshold. Not a stock ticker, but one where I can input the indexes I like and get instant updates, whether it be pop-ups or sound.  I hope it exists. Thanks",https://www.reddit.com/r/investing/comments/1jw0zwd/desktop_stock_alert_app_paid_or_free/,,https://www.reddit.com/r/investing/comments/1jw0zwd/desktop_stock_alert_app_paid_or_free/
2025-04-10 15:39:38,First timer advice on putting 7K into a traditional IRA at Fidelity.,DaydrinkingWhiteClaw,2,"As the title states, I need to invest 7K into a traditional IRA at Fidelity before the tax deadline. I have already opened the account and put the money there. I just need to know how to divide the funds. I’m leaning towards ETF’s because I have heard that’s a safer choice in this kind of market (I read about $VTI and $VXUS), but the truth is I don’t know shit about fuck and I need someone to hold my hand and tell me exactly what to do. Like, which ones, how much in each out of the 7K total, etc. Please talk to me like I’m 5, since I have never done this before. I’d really appreciate the guidance!",https://www.reddit.com/r/investing/comments/1jw0ydi/first_timer_advice_on_putting_7k_into_a/,,https://www.reddit.com/r/investing/comments/1jw0ydi/first_timer_advice_on_putting_7k_into_a/
2025-04-10 15:34:51,"The Market isn't a safe place for investments, with manipulators at the helm.",Captain-i0,492,"The problem with this investment environment is that we have someone willing to manipulate the market as he sees fit, whilst gutting regulatory bodies that could potentially do anything about it.

The market is going to react to Trump's social media posts, whether anything comes of them or not now. We will see huge market swings next time he posts something vague, and maybe he follows through, maybe he doesn't. Only those in his circle get the real info.

Musk, who owns Twitter, is (to a lesser extent) similarly poised to manipulate sentiment and cause run-ups or sell-offs. He's been reprimanded many times already for doing so, and now has freedom to do it.

This is corruption of the highest magnitude. We have not seen it, like this in this country before. It's possible that our economy, overall, is strong enough to weather this, but other economies that have gone through this kind of banana republic shit have all ended up completely decimated.

Up or down is not what I am looking at. I am not buying back in until there is stability.",https://www.reddit.com/r/investing/comments/1jw0uan/the_market_isnt_a_safe_place_for_investments_with/,,https://www.reddit.com/r/investing/comments/1jw0uan/the_market_isnt_a_safe_place_for_investments_with/
2025-04-10 15:31:53,On advice to make the most of potential dips.,DaInvictus,0,"Non government agencies, governments across the world, money managers and firms have raised the expected probability of a recession in the near future. As a novice with very little experience in the equities market and the economy more generally, I'm looking for advice and more specifically specialized learning material that can be used to make the most of potential dips.

I'm curious as to how I can analyze the situation and make estimates as to which sectors, and further more which companies would be a good investment. Also, the right way to diversify my portfolio.

I'd prefer getting quite technical with this to get a quantitative idea than a merely qualitative one. 

Thank you for your time :)",https://www.reddit.com/r/investing/comments/1jw0ru0/on_advice_to_make_the_most_of_potential_dips/,,https://www.reddit.com/r/investing/comments/1jw0ru0/on_advice_to_make_the_most_of_potential_dips/
2025-04-10 15:27:16,Should I lump sum or DCA 100 thousand,CapsOvi13,8,"Hey Everyone,

I was given 100k to invest in ETFs. I was wondering if you all think I should lump sum or DCA. If you think I should DCA over what weekly period should I do it. As of now there will be no additional money put in for investment but that could change. Thanks!",https://www.reddit.com/r/investing/comments/1jw0ns4/should_i_lump_sum_or_dca_100_thousand/,,https://www.reddit.com/r/investing/comments/1jw0ns4/should_i_lump_sum_or_dca_100_thousand/
2025-04-10 15:19:10,safest investment during this downturn for an IRA in Robinhood,reddit-set-go-2025,2,"So what is the safest thing to move my funds into in robinhood? There are no money market options and gold and silver is also going up an down... everything seems bad. I'd like to put it into a bank account but can't do that. So what options are there?

Everything I look at is having REALLY bad days... So I'd like to move it all to Paypal Savings but I cant do that :-) 

",https://www.reddit.com/r/investing/comments/1jw0guk/safest_investment_during_this_downturn_for_an_ira/,,https://www.reddit.com/r/investing/comments/1jw0guk/safest_investment_during_this_downturn_for_an_ira/
2025-04-10 14:53:59,What's the most tax-efficient way to invest in US Treasuries for a non-US investor?,rolsyker,0,"I might be wrong, but my understanding is that

1. US treasury interest payments are not taxed for foreign investors (if held directly) 
2. Dividends paid from a US bond ETF are subject to a dividend withholding tax but there is no capital gains tax (for foreign investors) 

So does this mean an accumulating US bond ETF is not taxable for a foreign investor? Is there a way to hold US Treasuries in a simple easy way while being tax efficient? 
",https://www.reddit.com/r/investing/comments/1jvzvfk/whats_the_most_taxefficient_way_to_invest_in_us/,,https://www.reddit.com/r/investing/comments/1jvzvfk/whats_the_most_taxefficient_way_to_invest_in_us/
2025-04-10 14:40:17,What are good financial advisors doing for their clients in this environment?,Dub_J,1,"Like many people, it is obvious to me that (1) the market is fucked due to political reasons that are not ""normal"" up and down cycles, and (2) DJT will manipulate us through many more peaks and troughs.   I really don't understand how the market is holding right now, the fall so far is modest compared to the damage that DJT has done and will do.   

 My guess is that the best strategy right now is to try to follow Trump's cronies.   Sell now and buy next time Trump scales up the trade war.   Then sell when he waffles.

I am frustrated that my advisor keeps preaching from the same gospel, about not timing markets, staying in for the long term etc.   I get that you don't want to miss the ups  (ask me about missing COVID)   But this feels **so far from normal**. 

Are people finding that advisors are adapting to the times and providing relevant advice?  Or is it just the normal playbook?

Edit- thanks for all the replies.  The roasting is generally fair.  

My key question - is this a normal downturn?  Most comments here are treating it as such.  Of course you don’t pull out in a downturn

When runoff law is threatened, when independence is economic oversight is in question. Etc etc is this still normal?  This isn’t just economic forces.  ",https://www.reddit.com/r/investing/comments/1jvzjwe/what_are_good_financial_advisors_doing_for_their/,,https://www.reddit.com/r/investing/comments/1jvzjwe/what_are_good_financial_advisors_doing_for_their/
2025-04-10 13:50:55,Expected Days to Market Bottom,l3ss,0,"Image: [Screenshot-2025-04-10-at-8-36-27-AM.png](https://postimg.cc/Jy5RP0Q1)

tl;dr: We are likely within a few short months from market bottom if not already there. 

The top graph shows RUT (Russell Small Cap 2000), which has been a reliable indicator of where we have been in terms of days to market bottom for the last 35 years. 

For the top graph (RUT), the y-axis is the log(price) which is required to get the trend line functions to work properly - not useful other than getting the script to work. Each trend line is a standard deviation from the log-linear mean (center black line). The vertical red lines are the transition from one standard deviation below the mean to the next market bottom. The SPY is the graph below which shows how it correlates to RUT pricing and market bottoms. I added the days to market bottom as a bar chart and, as shown, only the two major recessions hit >100 days. With the current price of RUT we are 14 days into the count.  

The main point is that when this index is below one standard deviation from the mean (bottom gray line) it's a good buying opportunity - and - shows that we are likely not far from a market bottom regardless of the situation. What I consider to be the ""short-term pain"" rhetoric.

Considering the extreme overvaluations during the 2000 market top and the havoc that occurred during the financial debacle during the end of the 2000s, the max time from the bottom was around 180 days (6 months) based on this analysis. 

That being said, the market is forward looking so if we hit 2 standard deviations below the mean, which has been close to occurring in all four recessions, then expect the economy to feel pain with unemployment rising for a an additional year (economic recovery lags market bottoms). ",https://www.reddit.com/r/investing/comments/1jvyeev/expected_days_to_market_bottom/,,https://www.reddit.com/r/investing/comments/1jvyeev/expected_days_to_market_bottom/
2025-04-10 13:45:37,Archer Aviation (ACHR) is Looking Like a Solid Bet 🌟✈️,Own_Specialist_6538,0,"So, Archer Aviation has been making some waves lately, and there are plenty of positive signs.
First off, let’s talk about today’s action—ACHR saw a nice 3% bump in its stock price, which is always a good sign. It traded as high as $7.28 before closing at $6.86. Not bad at all for a company that’s still in growth mode. The volume was a bit lighter than usual (about 9.7 million shares vs. an average of 19.9 million), but that doesn’t necessarily mean anything negative—sometimes it just means investors are holding tight and waiting for the next big move.

Now, here’s where things get even more interesting. Analyst upgrades are pouring in for Archer, with Cantor Fitzgerald raising their price target to $13.00, up from $10.00, and issuing an """"overweight"""" rating. That’s not the only upgrade; other firms like Canaccord Genuity and Needham have followed suit, bumping their price targets to around $13.00 and $13.50. Even Deutsche Bank joined the party, lifting their target to $15.00. Overall, analysts seem pretty bullish with a """"Moderate Buy"""" consensus rating and a price target of $11.61. That’s a solid upside potential from where it’s trading right now.

On the financial side, Archer is looking healthy, with a low debt-to-equity ratio of just 0.16, meaning they aren’t over-leveraged. The company also reported better-than-expected earnings last quarter, posting an EPS of -$0.30 when analysts were expecting -$0.40. Small wins like that go a long way in building investor confidence.

There’s also been some institutional interest. Big institutions jumping in is often a sign that the stock has long-term potential. Plus, insiders are still holding onto a good chunk of shares, with 9.75% ownership—so they have skin in the game, too.

Of course, like any stock, ACHR isn't without risk, but with strong analyst support, solid financials, and increasing institutional backing, it seems to be moving in the right direction. Keep an eye on this one—it could be a solid play as the electric aviation space takes off. ",https://www.reddit.com/r/investing/comments/1jvya6c/archer_aviation_achr_is_looking_like_a_solid_bet/,,https://www.reddit.com/r/investing/comments/1jvya6c/archer_aviation_achr_is_looking_like_a_solid_bet/
2025-04-10 13:20:49,So what's the alternative to U.S. Bonds?,452e4b2e,21,"United States bonds are supposed to be the safest investment vehicle anyone can make. 

With bond rates spiking indicating a sell off, where are people moving their money to?


* Sitting on cash makes no sense as it just depreciates.
* Stock market is unpredictable.


***What's the alternative?***",https://www.reddit.com/r/investing/comments/1jvxr4l/so_whats_the_alternative_to_us_bonds/,,https://www.reddit.com/r/investing/comments/1jvxr4l/so_whats_the_alternative_to_us_bonds/
2025-04-10 12:54:35,"US Inflation rate eases to 2.4% in March, lower than expected",II-TANFi3LD-II,170,"[CNBC Article Link](https://www.cnbc.com/2025/04/10/inflation-rate-eases-to-2point4percent-in-march-lower-than-expected.html)

>The consumer price index, a broad measure of goods and services costs across the U.S. economy, fell a seasonally adjusted 0.1% in March, putting the 12-month inflation rate at 2.4%.


>Excluding food and energy, so-called core inflation ran at a 2.8% annual rate, having increased 0.1% for the month. That was the lowest rate for core inflation since March 2021.

>Slumping energy prices helped keep inflation tame, as a 6.3% decline in gasoline prices helped drive a 2.4% broader decline in the energy index. Food prices climbed 0.4% on the month. Egg prices rose another 5.9% and were up 60.4% from a year ago.

>Moreover, shelter prices, among the most stubborn components of inflation, increased just 0.2% in March and were up 4% on a 12-month basis. Used vehicle prices were off 0.7% while new vehicle costs increased just 0.1%, ahead of tariffs that are expected to hit the auto industry hard.

Edit: This post contains no editorial changes or opinions from myself. The title and contents are quotes from the linked article.",https://www.reddit.com/r/investing/comments/1jvx6xv/us_inflation_rate_eases_to_24_in_march_lower_than/,,https://www.reddit.com/r/investing/comments/1jvx6xv/us_inflation_rate_eases_to_24_in_march_lower_than/
2025-04-10 12:50:02,Gold vs S&P500: Correct Window for Correlation Analysis?,ObliviousRounding,0,"I am trying to generate a chart that plots correlation vs time for gold spot prices vs the S&P500 index. I am struggling to identify the appropriate length in days for the rolling window; every choice I'm using seems to give me artifacts (there's always some periodicity in the chart, with the period close to the length of the window I choose). Any guidance on this would be appreciated.",https://www.reddit.com/r/investing/comments/1jvx3n0/gold_vs_sp500_correct_window_for_correlation/,,https://www.reddit.com/r/investing/comments/1jvx3n0/gold_vs_sp500_correct_window_for_correlation/
