created_utc,title,author,score,text,url,image_url,permalink
2025-04-08 23:53:33,I don't think you guys understand how bad shit is going to get...sell now,blueorangan,0,"**This is NOT a drill, folks.**

We’re all hearing the news about COVID-19 spreading quickly, and now countries are starting to implement lockdowns. I’m not sure if everyone fully understands just how much this is going to affect the global economy, but we’re about to see a chain reaction that could send the stock market into freefall.

Here’s why I think the worst is still ahead of us:

1. **Lockdowns Are Going to Crush Businesses** Businesses everywhere are already starting to feel the strain. We’re talking about massive industries grinding to a halt, retail stores closing their doors, restaurants shuttering indefinitely, and airlines cutting flights. This isn’t just a temporary slowdown – lockdowns will stop economic activity for an indefinite amount of time. If this goes on for months, there’s no way the stock market can keep up. When companies start reporting losses, investors will panic, and the selling will begin. Expect major corrections, or worse.
2. **Unemployment Is About to Skyrocket** With businesses forced to close their doors, people are going to lose jobs. The service industry, retail, and entertainment sectors will be hit hardest. Once this happens, consumer confidence will plummet, and spending will slow to a crawl. People won’t be buying as much, and businesses won’t be able to recover. This is a recipe for disaster, and it’s hard to imagine the stock market staying afloat when millions of people are suddenly out of work.
3. **The Stock Market Is Overvalued and Fragile** Let’s face it – the stock market has been on an unsustainable upward trajectory for years. Investors have been riding high on the expectation of steady growth, but now reality is setting in. Once the full scope of the pandemic hits, markets will react. We could be looking at the worst crash since the 2008 financial crisis. The economy is about to go into a tailspin, and the stock market doesn’t stand a chance.
4. **Long-Term Economic Recession** It’s not just a temporary dip in the market. Once the dust settles, we’re looking at a long-term economic slowdown. The global economy relies on constant movement – constant production and consumption. If that stops, it’ll take years to recover. And let’s not forget, governments can’t just keep printing money forever without inflation catching up. We could see hyperinflation, followed by another round of economic pain for the average consumer.

**I don’t mean to be an alarmist, but now is the time to start preparing for a rough ride ahead.** If you’ve got money tied up in the stock market, I’d seriously consider whether you want to ride out this coming crash. The world is about to change in ways we can’t predict, but we know one thing for sure: the stock market is going to be hit HARD.

Please don’t ignore this. Be smart, plan ahead, and be ready for the worst.

Stay safe, everyone.",https://www.reddit.com/r/investing/comments/1jusa1y/i_dont_think_you_guys_understand_how_bad_shit_is/,,https://www.reddit.com/r/investing/comments/1jusa1y/i_dont_think_you_guys_understand_how_bad_shit_is/
2025-04-08 23:23:58,"Concerned for the next 2-4 years, but not beyond that.",RelevantHelicopter82,0,"People seem very worried that these geopolitical relationships will take forever to repair. I disagree. The GOP is shooting itself in both feet by indulging this madness, and the majority of foreign nations are going to welcome a return to normalcy with open arms when the pendulum inevitably swings back. That said, I think it’s gonna be a wild 2 years (while all three branches are GOP controlled) and an annoying 4 years with many more trumpertantrums to be thrown. The damage he does won’t be irreversible, but I’m sure it will take a bit of time to mend all the broken bridges. The market, on the other hand, will mend as soon as there’s an inkling of hope - as seen yesterday - and while I acknowledge a strong bias on this matter, I’ll still be cautiously enjoying the many discounts until then. 

",https://www.reddit.com/r/investing/comments/1juro4r/concerned_for_the_next_24_years_but_not_beyond/,,https://www.reddit.com/r/investing/comments/1juro4r/concerned_for_the_next_24_years_but_not_beyond/
2025-04-08 23:00:13,Economic Indicators Amid New Tariffs,AirwickS,9,"Hey everyone,

As these new tariffs start to roll out, what economic indicators are you keeping an eye on? It feels like we’re in Act 1 of a longer story. I imagine Act 2 will unfold over the next few weeks and months as the effects start to ripple through the economy.

Are you watching inflation, employment data, or something else? And which indicators do you think offer the earliest signals about the economy’s health?

I’m not looking to bottom fish or make any short-term moves... just genuinely curious how folks are thinking about this!",https://www.reddit.com/r/investing/comments/1jur5nw/economic_indicators_amid_new_tariffs/,,https://www.reddit.com/r/investing/comments/1jur5nw/economic_indicators_amid_new_tariffs/
2025-04-08 21:57:50,"Strategies for tax loss harvesting for a DCAing ""set and forget"" type investor",BiggH,1,"I tend to follow the conventional boglehead strategy of a simple portfolio structure, DCAing, and setting and forgetting. As a result, I basically never have short-term capital gains. Actually, I've barely ever realized gains at all.

However, recently, for obvious reasons, I've come into some significant harvested losses. (I've been using wealthfront's S&P500 direct portfolio with automatic tax loss harvesting) The amount is big enough that the 3k per year carryover that I can deduct from my income is not going to make much of a dent in it.

I feel like this is suboptimal because I'm not taking advantage of the harvested losses. Ideally, I would take these losses and use them to offset short-term capital gains to get the maximum tax savings, but I have none.

What are some methods of extracting value out of these harvested losses?",https://www.reddit.com/r/investing/comments/1jupsli/strategies_for_tax_loss_harvesting_for_a_dcaing/,,https://www.reddit.com/r/investing/comments/1jupsli/strategies_for_tax_loss_harvesting_for_a_dcaing/
2025-04-08 21:53:05,How are you all handling these days?,razknal68,32,I feel like everyday is the same and everyday is different lol. Any investment analysts in? How are your days like these days? I feel theres only so many ways one can try to calm clients because it's looking grim right now hahaha. Trying to see through the uncertainty right now is difficult...any advice for a new investment analyst getting tested by fire? 😂,https://www.reddit.com/r/investing/comments/1jupopy/how_are_you_all_handling_these_days/,,https://www.reddit.com/r/investing/comments/1jupopy/how_are_you_all_handling_these_days/
2025-04-08 21:11:32,Looking for an app that will let me practice investing with fake money,Julie-h-h,7,"Hi! I'm looking for an app that will let me day trade with fake money. I'm not looking to learn the minutiae of the system, just trying to mess around for fun. I've tried a couple from the app store, but they're all stuffed with AI tutorials and crypto shilling, and that stuff makes me want to put my phone in a blender. Any suggestions?",https://www.reddit.com/r/investing/comments/1juopql/looking_for_an_app_that_will_let_me_practice/,,https://www.reddit.com/r/investing/comments/1juopql/looking_for_an_app_that_will_let_me_practice/
2025-04-08 21:11:01,How many rate cuts do you think we'll have this year? And when do you think the next one will be?,Happy_Weed,0,"Markets are now pricing in four rate cuts for the year, while the Fed’s most recent guidance still points to just two. That’s a pretty big difference. I'm curious to hear what this sub thinks. 

How many rate cuts will actually happen in 2025, and when do you think the next one will come? Will the Fed stick to its plan, or will they be forced to pivot based on economic data?",https://www.reddit.com/r/investing/comments/1juopak/how_many_rate_cuts_do_you_think_well_have_this/,,https://www.reddit.com/r/investing/comments/1juopak/how_many_rate_cuts_do_you_think_well_have_this/
2025-04-08 20:59:50,401k re-investment advice,hollow28,0,"Howdy, I left my employer last year and have just now been able to get my 401k accounts rolled over to Schwab. My investments were totally self directed, and I'm comfortable with the same investments. My only question is should I reinvest everything in a lump sum? Or would it be better to spread it out, and if so, over what time period? It's about $160k. I'm not trying to time the market, I have 30 years before retirement, I guess I'm just thinking that with how volatile things are, spreading things out could be a smart move. Thanks! ",https://www.reddit.com/r/investing/comments/1juofox/401k_reinvestment_advice/,,https://www.reddit.com/r/investing/comments/1juofox/401k_reinvestment_advice/
2025-04-08 20:57:15,Anyone else get in on SCHD under $24.50?,naturalhairtingz,0,"I’m curious — how many of y’all managed to scoop up SCHD under $24.50? I grabbed 7 shares at just under $24.10. My DCA was technically yesterday, but I couldn’t resist pulling the trigger again.

Definitely need to slow down on the dry powder though — gotta make sure I’ve still got some when I really need it haha.

How low did you manage to get in? Or are you waiting for a bigger dip?",https://www.reddit.com/r/investing/comments/1juodjl/anyone_else_get_in_on_schd_under_2450/,,https://www.reddit.com/r/investing/comments/1juodjl/anyone_else_get_in_on_schd_under_2450/
2025-04-08 20:46:12,Thinking about buying ITM puts with a 6 month DTE.,BlueWaffle135,0,"What do you think about this idea.

For example tomorrow, I am planning on buying a $660 SPY put that expires on 9/19

I believe we will be entering a bear market, and we are right on the threshold. (Down 19% from all time high) 

What do you all think of this idea? ",https://www.reddit.com/r/investing/comments/1juo43q/thinking_about_buying_itm_puts_with_a_6_month_dte/,,https://www.reddit.com/r/investing/comments/1juo43q/thinking_about_buying_itm_puts_with_a_6_month_dte/
2025-04-08 20:08:24,Wash sale rule question for tax loss harvesting,IShouldQuitThis,1,"I want to sell a broad market mutual fund to harvest tax losses, but I put a small amount of money in the fund a few days before the tariff announcements. Would having invested in the security at all less than 30 days before selling disqualify me from taking the tax loss, or could I still claim the loss except for the small amount invested within the 30 days. I'm at Schwab and wondering if anyone knows how they calculate this in particular as well.",https://www.reddit.com/r/investing/comments/1jun7k9/wash_sale_rule_question_for_tax_loss_harvesting/,,https://www.reddit.com/r/investing/comments/1jun7k9/wash_sale_rule_question_for_tax_loss_harvesting/
2025-04-08 19:43:04,Do you believe it’s a good time to buy in right now? Why or why not?,Little-Principle-150,0,"So many “buy the dip” posts

I feel like there’s a lot of things that you have to take into consideration when determining if something is a dip. It’s not every day that aggressive tariffs and the uncertainty of them is determining the stock market. 

It’s also irresponsible to compare this to the 2022 market, the Covid market, the 2008 market, and EVEN the great depression stock market. 

Why not the Great Depression market (which was driven by protectionism and tariffs)? Today we are in a time of advance tech, robotics, AI, 3-D printing and these methods will inevitably take over mass domestic production at lower costs. You cannot compare the two.

I have not been for the tariffs. I’m fairly conservative on things, however, I’m not for Trump.

I would love to hear YOUR reasons for you really think this is actually a dip, or do you think this is more so red flags of a much larger dip coming 
",https://www.reddit.com/r/investing/comments/1juml7z/do_you_believe_its_a_good_time_to_buy_in_right/,,https://www.reddit.com/r/investing/comments/1juml7z/do_you_believe_its_a_good_time_to_buy_in_right/
2025-04-08 19:27:08,FIRE Allocation investment help,Legitimate_Agency662,0,"Hello Redditors!

I am trying to build a portfolio in order to reach FIRE within the coming years. I have been using ChatGPT to help me build a portfolio but maybe you guys have better experience/insights.

I am 29 years old, married with 1 dependent. Monthly expenses are $6600. Yearly income of around $180k Have about $2000-$2800 left to invest every month

401K ($14k)- contributing 6% which my employer matches 100%, 100% allocated to VOO.

Roth Ira, I have been maxing it for the past few years and have about $36k mostly allocated to VOO.

Taxable Brokerage - $3000 - random funds.

The goal i have is to allocate it between SCHD/JEPI/O/VOO/QQQM.

How would you guys build this portfolio?

Thanks in advance!!",https://www.reddit.com/r/investing/comments/1jum7qh/fire_allocation_investment_help/,,https://www.reddit.com/r/investing/comments/1jum7qh/fire_allocation_investment_help/
2025-04-08 19:16:52,Bogleheads - An Understanding,MrSincerao,0,"What are your thoughts on the Boglehead philosophy? How would you rate the ""Buy VT and chill"" strategy?

As a non-US investor (foreigner) some may face a hard time deciding wich way to go when diversifying internationally. Would be nice to have some insights from more experienced investors.",https://www.reddit.com/r/investing/comments/1julywa/bogleheads_an_understanding/,,https://www.reddit.com/r/investing/comments/1julywa/bogleheads_an_understanding/
2025-04-08 18:52:05,Max Pain Hypothesis - SPY to $535 April 11?,TheCuriousBread,0,"Max Pain Hypothesis suggests that market makers and whales tries to make the maximum amount of options expire worthless to minimize their losses and maximize profits. 

At the moment, the Max Pain price for SPY contracts expiring April 11 is $535. With a put call ratio of 2.35. 

Given of course max pain works best for smaller stocks since no one can truly control the entire stock market. 

However if we look at smaller stocks like Super Micro for instance they do follow max pain slightly more. ",https://www.reddit.com/r/investing/comments/1julddx/max_pain_hypothesis_spy_to_535_april_11/,,https://www.reddit.com/r/investing/comments/1julddx/max_pain_hypothesis_spy_to_535_april_11/
2025-04-08 18:37:25,Portfolio Rebalancing / Allocation Strategies,FreedomIsMyRight,1,"Afternoon All,

I (56m) rebalanced my company sponsored (Merrill Lynch managed) portfolio in late January.  Overall portfolio at the time was a bit heavy with conservative investments (bonds, stable value, etc.) - probably around a 60% conservative / 40% aggressive balance.

After rebalancing, I shifted a bit to a more aggressive (55% stocks / equities, 35% stable value and 10% bonds) portfolio.  I have “ridden the current wave” and, to this point, have been hit to the tune of a (6%) loss since rebalancing.

Although results over the 6 years will ultimately be the determining factor, my plan was to retire at 62.  Currently, I have been thinking that I would continue investing as my allocation currently sits with the mindset that, while I do understand that we have probably not “hit bottom”, I would be buying at a reduced amount if nothing else.  However, I am also thinking perhaps my overall portfolio should include more bonds.  A few questions I have - would appreciate your thoughts / guidance on:

1:  is my 35% stable value plus 10% bond allocation (together) “conservative enough” given my age?  Should I have more allocated to bonds and less to stable value?

2.  If I proceeded with a rebalance at this time, concerned I would be selling my stocks / equities at a loss.  Would it be better to try and weather the storm before rebalancing or pull the trigger now?

3.  Would it make sense to consider a full portfolio rebalance to target date fund (say 2030 or 2035)?  I have not ever included TDF’s in my portfolio and the common thinking is that this is an “all or nothing” approach from most folks…assuming if this would be a good approach that the 2035 would be more aggressive at this time while the 2030 would probably be an even blend aggressive to conservative and continue in the conservative direction.  While “protecting the house” is certainly a concern at my age, I don’t want to get involved in a fund that doesn’t let me recoup the bit I have taken by being too conservative.

Long read and truly appreciate your thoughts.

Thank you!

",https://www.reddit.com/r/investing/comments/1jul0gw/portfolio_rebalancing_allocation_strategies/,,https://www.reddit.com/r/investing/comments/1jul0gw/portfolio_rebalancing_allocation_strategies/
2025-04-08 17:02:15,Thoughts on ETFs focusing on the Far East?,RoronoaZorro,2,"So, I have been browsing numerous different ETFs with all sorts of specifics, and when browsing Asian ETFs I realised there are none that quite offer what I would consider intriguing as a small position.

Eventually, I stumbled upon a few ""Far East"" ETFs and thought their composition (or the one of one in particular) was quite interesting.  
It offers China, Taiwan, Hong Kong, South Korea & Singapore alongside Thailand, Indonesia & Malaysia.

So, really, apart from India & maybe Vietnam, those are arguably all of the Asian (ex-Japan) countries that people might expect to have high sustained growth potential going forward alongside the some of the more established ""safer"" bets.

So, I'm wondering - what do you think about this? What do you think about this ETF?  
If you wanted to get involved with Asia, which countries would you like to see represented instead & what do you generally expect from Asia/these regions going forward?

ETF in question:  
Ticker: ACUU  
ISIN: LU2439119236  
[justETF profile](https://www.justetf.com/en/etf-profile.html?isin=LU2439119236#uebersicht)

Disclaimer: I will **not** buy this ETF, and that's decided, regardless of what gets commented here. Between the small size,the high TER & the general uncertainty around large parts of S/SE Asia, it's a clear no from me, even for a small position.  
Still interested in your thoughts, though.

Thanks for sharing your thoughts!",https://www.reddit.com/r/investing/comments/1juimhg/thoughts_on_etfs_focusing_on_the_far_east/,,https://www.reddit.com/r/investing/comments/1juimhg/thoughts_on_etfs_focusing_on_the_far_east/
2025-04-08 16:51:30,"US Justice Dept disbands crypto enforcement team, citing Trump order",newleafkratom,649,"[Via Reuters](https://www.reuters.com/world/us/us-justice-dept-disbands-cryptocurrency-enforcement-unit-2025-04-08/)

""...The Deputy Attorney General's Monday memo said the Justice Department would stop targeting virtual currency exchanges, offline wallets and services known as mixers and tumblers designed to make crypto transactions anonymous, for ""acts of their end users or unwitting violations of regulations"".

Blanche, one of President Trump’s former criminal defense attorneys, was [confirmed](https://www.reuters.com/world/us/us-senate-confirms-ex-trump-defense-lawyer-deputy-attorney-general-2025-03-05/) last month in the No. 2 role at the Justice [Department.In](http://Department.In) his memo, he ordered prosecutors not to charge regulatory violations under federal banking, securities and commodities laws unless there is evidence that the company or individual willfully violated licensing or registration requirements.

Crypto is a sector in which Trump and his family now have a stake. Reuters previously [reported](https://www.reuters.com/business/finance/how-trump-family-took-over-crypto-firm-it-raised-hundreds-millions-2025-03-31/) that the Trump family has a claim on 75% of net revenues from token sales by World Liberty Financial, a crypto venture...""",https://www.reddit.com/r/investing/comments/1juicto/us_justice_dept_disbands_crypto_enforcement_team/,,https://www.reddit.com/r/investing/comments/1juicto/us_justice_dept_disbands_crypto_enforcement_team/
2025-04-08 15:18:53,Where to invest right now to take advantage of the market,Ill-Quantity-9909,0,"Hi all,

I currently have around 10k+ (GBP) invested in Vanguard Life Strategy 100. I've been planning on moving this out to Global All Caps anyway, so I'm going to do that soon to take advantage of the current market. 

I \*could\* also invest a fresh additional 1k somewhere, I'd prefer it to be somewhere I can just passively leave it tbh, so it might make sense to just add to the Global All Caps amount. However if you were to say that there is a strategy to invest in something for 1-5 years and keep an eye on it, I'd be open to that. I'm not asking you to tell me directly which fund to invest in, more to tell me what I should be looking for and useful resources. Thanks. ",https://www.reddit.com/r/investing/comments/1jug4a8/where_to_invest_right_now_to_take_advantage_of/,,https://www.reddit.com/r/investing/comments/1jug4a8/where_to_invest_right_now_to_take_advantage_of/
2025-04-08 15:17:48,US federal 450 filing and roboinvestors,Needhelpcantquit,4,"Hi wondering if anyone has experience with roboadvising, Wealthfront for bonus points, and how you handle 450 filings. Looking into using roboadvising but wondering if Wealthfront is going to buying/selling so many different stocks that it will make 450 filings a nightmare. TIA!",https://www.reddit.com/r/investing/comments/1jug3ex/us_federal_450_filing_and_roboinvestors/,,https://www.reddit.com/r/investing/comments/1jug3ex/us_federal_450_filing_and_roboinvestors/
2025-04-08 15:07:40,Should I invest my savings into S&P500?,Amir_NMotassim,0,"I have about 7k in cash just sitting and I’d like for it to grow. I know S&P500 is good for long term investments and I’m not sure if I should invest my money or not. My coworker told me he’d rather use the money I have towards paying off my car loan(72 months, 20k at 10.14%) vs putting it into stocks. He said S&P500 has an annual return of about 8% so I’d technically save 2% if I put it towards the loan. 

Can I invest it for like a year and let it grow then use some of that towards the car loan? Would you prefer to let it sit for years on end or use it towards the loan at some point whether it be now or a year or 2 down the line? I’d keep a grand or 2 just in case I ever need it for emergencies but I’m not sure what to do so I came to you guys to ask. 

Edit: I’m 21 and still live with my family if it matters.  I work full time and go to school",https://www.reddit.com/r/investing/comments/1jufuka/should_i_invest_my_savings_into_sp500/,,https://www.reddit.com/r/investing/comments/1jufuka/should_i_invest_my_savings_into_sp500/
2025-04-08 15:00:53,How do you realize losses from a bankrupt company?,JETT899,1,"Hello all, I could not really find any good info for this by googling so thought I would come here instead. I sold PLTR almost 2 months ago for a capital gain, and to avoid taxes I would like to claim losses on a bankrupt company (Fisker, I just believed in them too much and let my heart do the talking) that is just sitting in my Schwab account. Cant sell the worthless shares, but is there anyway to make these unrealized losses become realized? Or is it just a wait it out game? ",https://www.reddit.com/r/investing/comments/1jufoe4/how_do_you_realize_losses_from_a_bankrupt_company/,,https://www.reddit.com/r/investing/comments/1jufoe4/how_do_you_realize_losses_from_a_bankrupt_company/
2025-04-08 14:58:52,To everyone who sold yesterday: How are you assessing the move after today's recovery?,MythrilBalls,0,"I’m hoping to spark a discussion with those who sold portions of their portfolios yesterday—how are you evaluating that decision in light of today’s market recovery? Were your sales part of a planned rebalancing or risk management strategy, or were they a reaction to recent volatility? I’m curious if you’re still comfortable with your reasoning, or if the rebound has prompted a reassessment of your approach. Given the unpredictable nature of these fluctuations, I’d like to hear how others are analyzing their moves—what metrics, indicators, or principles guided your decision to sell, and how do today’s gains factor into your broader investment framework? Looking forward to some insights on managing these shifts!",https://www.reddit.com/r/investing/comments/1jufmjw/to_everyone_who_sold_yesterday_how_are_you/,,https://www.reddit.com/r/investing/comments/1jufmjw/to_everyone_who_sold_yesterday_how_are_you/
2025-04-08 14:51:17,Efficient way to short US 2yr and 5yr bonds?,EasyWanderer,2,"Anyone know an instrument we can use to short US bonds?

My reasoning is the tariffs will rise the inflation again. Fed might have to raise rates let alone cut them. If this happens the stock market will crash (though might be limited after down a lot) and US bond rates will rise. When rates are up, bonds prices go down hence shorting them will make money.

I looked it up a bit couldn’t find any instrument. There is one to short TIPS but that’s inflation protected so wouldn’t work.",https://www.reddit.com/r/investing/comments/1jufg2h/efficient_way_to_short_us_2yr_and_5yr_bonds/,,https://www.reddit.com/r/investing/comments/1jufg2h/efficient_way_to_short_us_2yr_and_5yr_bonds/
