created_utc,title,author,score,text,url,image_url,permalink
2025-04-07 10:56:43,Are the tariffs the real problem or just a reality check?,Creepy_Artichoke_479,0,"Disclaimer: not an American and I have little interest in politics, my question/opinion is solely a financial one.

So everyone is blaming Trump for the recent drop in the stock market, and losing them money, and yes, if you look at the small picture this is due to the tariffs.

But this also contradicts something that people constantly say. ""Time in the market beats timing the market"" (implying that the stock market should average out and trend up over time, so it's better to slowly invest over time you should be better off).

If we read this and agree, then it seems we have nothing to worry about, because $600 ($SPY as an example) was the true value based on fundamentals and the economy over all, then eventually it will reach that price again.

But I think the big issue is that it should never have been valued that high. After COVID, which was a legitimate reason for a drop in the markets worldwide, the US Government (or the Federal Reserve which acts independently to the elected Government I believe) printed off and invested trillions and trillions of dollars into the stock market, and also gave out money, which a lot of bored people used to invest in the stock market.

This, and the coinciding tech boom caused by people working from home and being at home more often, created a generation of people who think that the stock market is an unlimited money glitch which only ever goes up with absolutely no consequences, and now they are shocked that it isn't the case after all.

So while Trump's tariffs kicked off this recent drop, is it something that has been coming for a long time and is way overdue? Had it not happened, and the market value had continued to increase, would it not be even more severe when something else caused a sell-off?

After all, if $600 is the true value of $SPY then should it not quickly recover as it's now so obviously undervalued. So while this may be self inflicted, and cannot be compared to the drop due to COVID, is it completely irrelevant to the true issue at hand, which is a bubble that was going to burst eventually?",https://www.reddit.com/r/investing/comments/1jtig36/are_the_tariffs_the_real_problem_or_just_a/,,https://www.reddit.com/r/investing/comments/1jtig36/are_the_tariffs_the_real_problem_or_just_a/
2025-04-07 10:39:10,WTI 3Oil - Is it time to get in?,tcallan21,0,"I've been watching 3OIL (WisdomTree WTI Crude Oil 3x Daily Leveraged) and wondering if now might be the right moment to start building a position. With WTI trading in the $60 range and showing signs of extreme volitility, 3OIL could offer serious upside for short- to mid-term plays — *if* you time it right.

I know the risks with this having been both burned and very successful with it in the past just wondering people's thoughts on this and I also know its a gamble as it totally depends on the side of the bed that our friend in the white house wakes up on this morning. 

Anyone else looking at 3OIL? What’s your strategy — short bursts, swing trades, or something else? And what’s your view on crude for the next few months?",https://www.reddit.com/r/investing/comments/1jti6n5/wti_3oil_is_it_time_to_get_in/,,https://www.reddit.com/r/investing/comments/1jti6n5/wti_3oil_is_it_time_to_get_in/
2025-04-07 09:57:51,How is withholding tax calculated for accumulating ETFs?,bloodbound11,2,"For an accumulating ETF like the SPYL, it had an annual dividend yield of 1.39% recently.

Assume the rate of return is 8% and withholding tax is 15% for the purposes of this example.  
  
Which of the below represents the correct way to calculate the rate of return percentage after the withholding tax:

1) 8% - 1.39% = 6.61% rate of return after the withholding tax

2) 100% (representing the entire 8% rate of return) - 1.39% = 98.61%

98.61% of 8% = 7.9833% rate of return after the withholding tax

",https://www.reddit.com/r/investing/comments/1jthko4/how_is_withholding_tax_calculated_for/,,https://www.reddit.com/r/investing/comments/1jthko4/how_is_withholding_tax_calculated_for/
2025-04-07 09:01:16,"Daily General Discussion and Advice Thread - April 07, 2025",AutoModerator,10,"Have a general question?  Want to offer some commentary on markets?  Maybe you would just like to throw out a neat fact that doesn't warrant a self post?  Feel free to post here! 

Please consider consulting our FAQ first - https://www.reddit.com/r/investing/wiki/faq
And our [side bar](https://www.reddit.com/r/investing/about/sidebar) also has useful resources.  

If you are new to investing - please refer to Wiki - [Getting Started](https://www.reddit.com/r/investing/wiki/index/gettingstarted/)

The reading list in the wiki has a list of books ranging from light reading to advanced topics depending on your knowledge level. Link here - [Reading List](https://www.reddit.com/r/investing/wiki/readinglist)

The media list in the wiki has a list of reputable podcasts and videos - [Podcasts and Videos](https://www.reddit.com/r/investing/wiki/medialist)

If your question is ""I have $XXXXXXX, what do I do?"" or other ""advice for my personal situation"" questions, you should include relevant information, such as the following:

* How old are you? What country do you live in?  
* Are you employed/making income? How much?  
* What are your objectives with this money? (Buy a house? Retirement savings?)  
* What is your time horizon? Do you need this money next month? Next 20yrs?  
* What is your risk tolerance? (Do you mind risking it at blackjack or do you need to know its 100% safe?)  
* What are you current holdings? (Do you already have exposure to specific funds and sectors? Any other assets?)  
* Any big debts (include interest rate) or expenses?  
* And any other relevant financial information will be useful to give you a proper answer.  

Check the resources in the sidebar.

Be aware that these answers are just opinions of Redditors and should be used as a starting point for your research. You should strongly consider seeing a registered investment adviser if you need professional support before making any financial decisions!",https://www.reddit.com/r/investing/comments/1jtgt39/daily_general_discussion_and_advice_thread_april/,,https://www.reddit.com/r/investing/comments/1jtgt39/daily_general_discussion_and_advice_thread_april/
2025-04-07 08:55:30,Is there any hope? Should I HODL?,Traditional_Ear_9828,0,"I'm in heavily in US stocks i.E sp500, amd a few other growth stocks. is there any positive catalyst that I can look at to just convince my self to just stop looking at the stocks and come back in a couple years? right now I'm worried if I leave it my stocks all just tank and I don't have a dogs doodoo in the future.",https://www.reddit.com/r/investing/comments/1jtgqcm/is_there_any_hope_should_i_hodl/,,https://www.reddit.com/r/investing/comments/1jtgqcm/is_there_any_hope_should_i_hodl/
2025-04-07 08:40:29,What are the safest non-stock investments to make during this period of uncertainty?,always_pizza_time,10,"My portfolio is currently made up entirely of individual stocks and ETFs (mainly VOO). But with the way things are going, even index funds aren't that safe because the entire market is crashing with no end in sight. Are there any other safe investment options I should be looking at if I want to avoid all this turmoil? Should I be buying gold? Government bonds? Something else? I only have experience buying stocks so have no idea what other investments I should be making right now.",https://www.reddit.com/r/investing/comments/1jtgjdm/what_are_the_safest_nonstock_investments_to_make/,,https://www.reddit.com/r/investing/comments/1jtgjdm/what_are_the_safest_nonstock_investments_to_make/
2025-04-07 08:34:55,You're Not Alone. Suicide Prevention Hotline,SPXQuantAlgo,241,"If you’re feeling overwhelmed, hopeless, or panicked because of the market crash—please take a moment. You are not alone. Your life is more important than any trade or portfolio. Help is available.

U.S. Suicide Prevention & Mental Health Resources:

988 Suicide & Crisis Lifeline – Call or text 988 (Free, 24/7)
Website: https://988lifeline.org

Crisis Text Line – Text HELLO to 741741 (Free, 24/7)
Website: https://www.crisistextline.org

National Alliance on Mental Illness (NAMI) – 1-800-950-NAMI (6264)
Monday–Friday, 10 a.m. – 10 p.m. ET
Website: https://www.nami.org/help

Veterans Crisis Line – Call 988, then press 1
Or text 838255
Website: https://www.veteranscrisisline.net

⸻

Please remember: markets recover. Losses can be rebuilt. Your life is precious and irreplaceable. Talk to someone. Stay.",https://www.reddit.com/r/investing/comments/1jtggrp/youre_not_alone_suicide_prevention_hotline/,,https://www.reddit.com/r/investing/comments/1jtggrp/youre_not_alone_suicide_prevention_hotline/
2025-04-07 08:18:31,"Given the current events, did you change your investing strategy?",Many-Coach6987,4,"Hello all,

I am invested since 10 years and DCA into MSCI World and an additional EM Index fund for diversification. Also I have some high quality/boring stocks in my portfolio. Given the strong US exposure of the MSCI World I intent to increase the exp to Europe.

I am no expert by any stretch but this downturn feels different, more structural because of political agendas rather economic issues. Hence my reduction to US exposure and increasing to Europe and maybe Asia…

Do you make structural changes in your strategy? What are these and why?",https://www.reddit.com/r/investing/comments/1jtg95a/given_the_current_events_did_you_change_your/,,https://www.reddit.com/r/investing/comments/1jtg95a/given_the_current_events_did_you_change_your/
2025-04-07 07:55:43,Just started a new job - is it standard practice to rollover my 401k from my prior company? What are my other options?,orcasunite,2,"For context, I’m 29, and I’m not sure if this should be mentioned, but I’ve been maxing out my Roth IRA account at the beginning of each year since 2022 (I’m regretting it now, lol). Should I keep my 401k from my prior company in that account, or should I rollover that amount to my new job's 401k? ",https://www.reddit.com/r/investing/comments/1jtfyhs/just_started_a_new_job_is_it_standard_practice_to/,,https://www.reddit.com/r/investing/comments/1jtfyhs/just_started_a_new_job_is_it_standard_practice_to/
2025-04-07 07:40:01,"Historically, do short-term Treasuries typically beat inflation?",lesarbreschantent,7,"With the flight-to-safety under way, the question is whether short-term Treasuries/SGOV can reliably beat inflation and thus protect you from that risk as well. 1/3-month Treasuries are doing so today, but how often do their real yields exceed 0?

If anyone can point to data sets/charts that show the historical record of short-term Treasury **real** yields, I would be grateful.",https://www.reddit.com/r/investing/comments/1jtfr4b/historically_do_shortterm_treasuries_typically/,,https://www.reddit.com/r/investing/comments/1jtfr4b/historically_do_shortterm_treasuries_typically/
2025-04-07 07:30:49,Lets play the call the bottom game 2025 edition!,wander9077,64,"SO there are no fabulous prizes other than maybe trying to catch a falling knife but lets put forth our best estimates of where the bottom could be.  If possible be sure to include your reasoning.  Here is my guess:

So the S&P was at 6144 on Feb 19th then we had the first Tariff shock and it sank roughly to 5500 (in part bouncing off 10% correction and then going back to about 5600-5700 range).  At that time Goldman Sachs noted consensus was the tariff announcement in early April would yield about 8% so the market was priced about right going into April 2nd (about 8% down from peak).  Then we had the announcement with a weighted average of about 24% tariff across all trading partners (JP Morgan numbers)  rather that the 8% the market expected.  If it were only that simple then we could reasonably expect the pricing in to be 24% below the 6144 peak or around another 14% down from the 5500 short term bottom before the april 2 announcement.  That number is about S&P 4700. 

BUT the market also now knows atleast some countries / regions will enact tariffs of there own in response although not all will.  This stands to further cause impact but remember they also clearly realize that reprisal tariffs hurt there own companies as much as they hurt the US also, the German, Spanish, Italian finance ministers have even voiced this since the announcement .  SO Im going to guess they take a more modest approach on average across all trading partners.  Im going to guess they do what the market expected the US to do in the first place which is a consensus of 8%.  So that takes 4700 down by another 8% to just around 4300.   If they were to do 10% instead then that would be more like 4200.   The S&P was trading at around 24 P:E on april 2, income will ofcourse dip going forward but the trailing P:E would be reduced to about 18.  It could easily overshoot but im sticking to my guess of **4300** what is everyone elses best guess.",https://www.reddit.com/r/investing/comments/1jtfmoq/lets_play_the_call_the_bottom_game_2025_edition/,,https://www.reddit.com/r/investing/comments/1jtfmoq/lets_play_the_call_the_bottom_game_2025_edition/
2025-04-07 07:06:34,Congratulations if you shorted Tesla.,Soggy-Bad2130,742,"Title pretty much says it. Tesla is down 12% in premarket trading today and already down over 50% from it's high in December.

Current P/E of 100+ is ridiculous and I personally think it should be worth less then 25$ a share. However, I have been following this stock and honestly: I never had the balls to short it. Seeing how irrational this stock behaved, and how many times short sellers got screwed. Never have I been more convinced a stock is incredibly overvalued though. but I admit I was too chicken.

I think the bubble has bursted and it wil keep dropping from where we are.  
Tesla is the main reason why I am not ""buying the dip"" with ETF's. It's my example/gauge of how the US stock market is still heavily overvalued right now.

Now that earnings, cashflow and margins are in decline, How low do you think it will go?",https://www.reddit.com/r/investing/comments/1jtfari/congratulations_if_you_shorted_tesla/,,https://www.reddit.com/r/investing/comments/1jtfari/congratulations_if_you_shorted_tesla/
2025-04-07 06:43:26,"What about inverse ETFs like SQQQ, VXX, and SPXS?",ninjannuity,18,"I don't know much about winning in the market. I've tried to learn through my poor decisions.

I have read about inverse leveraged ETFs like SQQQ, VXX, and SPXS. They're up overnight, and in general, with the current state of things.

I don't know much about them and I'm not seeking financial advice, I'm interested in them as opportunities and would like to know more.",https://www.reddit.com/r/investing/comments/1jteyxj/what_about_inverse_etfs_like_sqqq_vxx_and_spxs/,,https://www.reddit.com/r/investing/comments/1jteyxj/what_about_inverse_etfs_like_sqqq_vxx_and_spxs/
2025-04-07 05:14:22,"Before you buy the next (layer) of the dip, keep in mind the below:",OppenheimerAltman,579,"We will face unprecedented volatility, and no one can predict the market’s reaction. As of today, markets in China, Taiwan, Japan, Russell futures, Australia, and Singapore have hit circuit breakers!
Even Bill Ackman was caught off guard and is now whining concerns on X. 

More turbulence awaits, so I strongly advise against timing the market. Instead, select entry points as political and policy stability emerges.

Key upcoming events! 

	1	“Reciprocal Tariff” responses likely begin Monday (tomorrow). EU will likely target tech sector 
	2	Fed Meeting Minutes - Wednesday
	3	March CPI Inflation data - Thursday
	4	Initial Jobless Claims data - Thursday
	5	March PPI Inflation data - Friday
	6	Michigan Consumer Sentiment data - Friday
",https://www.reddit.com/r/investing/comments/1jtdp93/before_you_buy_the_next_layer_of_the_dip_keep_in/,,https://www.reddit.com/r/investing/comments/1jtdp93/before_you_buy_the_next_layer_of_the_dip_keep_in/
2025-04-07 04:37:32,I invested most of my money a month ago and am having serious regrets,Greedy_Principle_342,224,"I guess I’m just looking for support and someone to tell me it will be okay. I was hanging onto a little over 200k for two years in a high-yield savings account. I still have a little over 50k, but am going through IVF, so I’m unsure how much will be left after. I have the other 150k invested now. 

Since investing, I’ve lost almost 30k. My financial planner says I’ll be okay and acts like it’s not a big deal. 

My other friend that’s a financial planner as well told me I invested at exactly the wrong time and I’m going to end up losing because of it. 

I’m freaked out. I’m so careful with my money, so it took me a long time to even work up to investing. I’m crushed and anxious. Especially now that we are headed towards a recession. I wish I hadn’t invested. :(",https://www.reddit.com/r/investing/comments/1jtd4gd/i_invested_most_of_my_money_a_month_ago_and_am/,,https://www.reddit.com/r/investing/comments/1jtd4gd/i_invested_most_of_my_money_a_month_ago_and_am/
2025-04-07 04:05:22,529 thoughts for high school kids?,MasterConclusion9509,0,"Scenario: my kid is in 9th grade. Her 529 is mostly index funds. It's lost like 5% over the last couple of weeks. In 2020, I had it in a 529 that was mdiversified with bonds and it lost money due to those bonds dropping in value so much and the stocks stagnating. I'm deciding between a.) leaving it and hoping for the best, b.) moving it back to a bond-heavy 529 based on some advice I read but which makes me nervous, and c.) pulling it for now and keeping it in a high yield savings account until the current crisis blows over (knowing that might be for the next entire 4 years of this administration and maybe even beyond if this sends us south). 

Thoughts? ",https://www.reddit.com/r/investing/comments/1jtclxh/529_thoughts_for_high_school_kids/,,https://www.reddit.com/r/investing/comments/1jtclxh/529_thoughts_for_high_school_kids/
2025-04-07 03:36:21,Should I Invest $10K From a 0% APR Credit Card Into Index Funds? (Unemployed Right Now),Muslim_conservative,0,"
Hey all,

I'm considering doing something a bit risky and wanted some honest feedback.

I have a 0% APR credit card with a $10,000 limit and an 18-month promotional period before interest kicks in. I was thinking: what if I invest that $10K into a broad index fund like VOO or SPY?

The logic is that the market *usually* trends up over time, and I could walk away with a few hundred to a few thousand in profit before paying off the card — assuming I sell and repay the balance before the 0% period ends.

Here’s the catch:  
**I'm currently unemployed.** No steady income right now, though I’m working on it. I don’t have any major debt, and I’ve got a small emergency fund — but not enough to cover the full $10K if the market tanks.

Also — does anyone know which **brokerages are safest** when using a credit card for funding? Or is that not even an option? I’ve used Fidelity and Schwab before with bank transfers, but I’m not sure how this would work with a credit card.

I know this is a gamble and not for the faint of heart. But I’ve heard stories of people using 0% cards strategically, and I’m wondering if this could be one of those situations… or just plain reckless given my current status.

**Any thoughts or advice?** Would love to hear from anyone who’s tried something similar.

",https://www.reddit.com/r/investing/comments/1jtc449/should_i_invest_10k_from_a_0_apr_credit_card_into/,,https://www.reddit.com/r/investing/comments/1jtc449/should_i_invest_10k_from_a_0_apr_credit_card_into/
2025-04-07 02:44:57,Market beta calculations from yahoo finance?,Old-Mouse1218,1,"hey all, I know yahoo finance is not great per say. But was just trying to do some basic market beta calculations for verifying an AI tool we've built, lets say for a small cap stock PLL, and if you control for frequency, loopback, if benchmark is SP500 or Russell 2000, yahoos market beta is totally off. Am I missing something? The closet thing I can get is if they are calculating betas using prices which seems like they are.",https://www.reddit.com/r/investing/comments/1jtb6lv/market_beta_calculations_from_yahoo_finance/,,https://www.reddit.com/r/investing/comments/1jtb6lv/market_beta_calculations_from_yahoo_finance/
2025-04-07 02:25:30,Calling all Crystal Ball Holders!,atomicnumber22,11,"Ha ha - just kidding.  But for reals, I think the market will keep tanking and I'm prepared to put my money back in when it gets low enough.

BUT, is there any scenario where the market doesn't come back in our lifetimes?  I read something that said that the market took 25 years to get back to its all time high after the Great Depression.  I'll be dead in 30 years, statistically speaking. 

After 2000, it took the S&P seven years to get back to its previous high.

Does anyone know about the history of the markets in other countries that fell to authoritarianism and whether their stock markets (if they have one) just never came back?  I realize there's a lot of ignorance in my question, and that's why I'm asking it - I have no freakin' idea, but I feel like what's happening now is unique and won't be like 2000 or 2008. 

Is there some scenario where the amount of cash I have right now in my IRAs is sort of it?  I get that I can earn 4% in safe investments, but that barely keeps up with inflation.  I'm concerned that there will be no way to grow my money.  
",https://www.reddit.com/r/investing/comments/1jtatr3/calling_all_crystal_ball_holders/,,https://www.reddit.com/r/investing/comments/1jtatr3/calling_all_crystal_ball_holders/
2025-04-07 02:08:09,How should I structure my investing during this time?,DrumRollPlease1012,0,"During this period of volatility I want to really maximize my future growth potential. I had around 100k (VOO , VTSAX, and NVDA) in the market prior to the market free fall.

I’ve been putting in 1k every few days into VOO while it crashes. Would you guys recommend to just throw a giant lump sum in or keep the ladder investments going?

I have another few decades before I exit the market so I’m not super risk averse.",https://www.reddit.com/r/investing/comments/1jtai9d/how_should_i_structure_my_investing_during_this/,,https://www.reddit.com/r/investing/comments/1jtai9d/how_should_i_structure_my_investing_during_this/
2025-04-07 01:58:32,Selling gains at the prospect of a decrease.,MichiganMan1992,2,"I have a question which I did a little googling and couldn't find an answer. 

Does anyone have a calculation or a good website that could help with this.  

In taxable accounts when does it make sense to sell a stock knowing you will have a taxable event ? 

When is the break even , when is the benefit ? If I sell a long hold in anticipation of a 5% drop, of course not worth the time but when does it ? 15% 20% 25% etc? 

( I am not thinking about selling in this trade off, 
I would use this as knowledge for future trades)

Thanks  ",https://www.reddit.com/r/investing/comments/1jtabza/selling_gains_at_the_prospect_of_a_decrease/,,https://www.reddit.com/r/investing/comments/1jtabza/selling_gains_at_the_prospect_of_a_decrease/
2025-04-07 01:46:32,I have a dollar cost averaging question.,Local_Historian8805,5,"My understanding is that dollar cost averaging is adding the same amount of money at a consistent interval in hopes that the purchase prices will average out over time. 

But, when I was little, I remember my dad having me make a table and we started with increments of $50. Every month, I would look at the price and see how much to add. 

Like month two, if there was no change, I would add another $50. If the money went down to say $45, I would have had to have added $55. If the account was at $57, I would have added $53. 

So each month, I had to see what month it was, where I should be, and how much to add. 

That still feels like dollar cost averaging, but does it have any other names?  Why am I the only one of my friend group who seems to do this? Is just adding the same amount at the same interval better?

Thanks so much. ",https://www.reddit.com/r/investing/comments/1jta4ct/i_have_a_dollar_cost_averaging_question/,,https://www.reddit.com/r/investing/comments/1jta4ct/i_have_a_dollar_cost_averaging_question/
2025-04-07 01:40:36,Mid-freefall questions on bottom targets and  hedges,jibboo2,0,"It would take an S&P range estimate of 4100-4500 if we reset to 16/17x earnings, a level in line with historical norms. 

1 -  what's your S&P bottom target range if this goes badly but not catastrophically?

2 - same thing, but if this thing really goes south with financial system risk amping up and/or squirrelly dollar behavior accelerating?  2500?

3 - why are both Bitcoin AND gold down 4% in the past five days?  Are consumer staples and international stocks just a better value this time around for hedging?",https://www.reddit.com/r/investing/comments/1jta0mo/midfreefall_questions_on_bottom_targets_and_hedges/,,https://www.reddit.com/r/investing/comments/1jta0mo/midfreefall_questions_on_bottom_targets_and_hedges/
