category,questions
Digital Assets,How can blockchain and decentralized finance (DeFi) transform traditional banking and payment systems?
Digital Assets,What are the key trends and emerging technologies that are expected to drive the future of digital assets and fintech services?
Digital Assets,What potential impact could Central Bank Digital Currencies (CBDCs) have on the future of traditional banking systems?
Digital Assets,How might the rise of digital wallets and contactless payments impact traditional banking systems and consumer behavior?
Digital Assets,How can blockchain and cryptocurrency technologies reshape cross-border payments and financial inclusion globally?
Digital Assets,What are the benefits and challenges of using stablecoins for cross-border payments in the current financial ecosystem?
Digital Assets,"How does regulatory clarity, or lack thereof, affect the adoption and growth of digital assets within traditional financial institutions?"
Digital Assets,What are the potential benefits and challenges of implementing AI-driven predictive analytics in personal finance and banking?
Digital Assets,What strategies should investors employ when deciding whether to hold or sell digital assets during market instability?
Digital Assets,"How do geopolitical events, such as changes in government policies, affect the valuation and volatility of digital assets?"
Fixed Income,"How do fixed income investments, such as bonds, compare in risk and return to equities in a volatile market?"
Fixed Income,What are the best strategies for protecting a fixed income portfolio against interest rate fluctuations?
Fixed Income,How do credit ratings affect the risk assessment and yield of different fixed income securities?
Fixed Income,What are the implications of a rising interest rate environment on the value of existing fixed income investments?
Fixed Income,"How do geopolitical factors, such as trade tensions or international relations, impact fixed income markets globally?"
Fixed Income,"How do interest rate changes affect the value of bonds, and how should investors adjust their strategies accordingly?"
Fixed Income,"What role do government bonds play in a diversified investment portfolio, and what are their potential risks?"
Fixed Income,What are the risks and benefits of investing in fixed income securities during periods of economic uncertainty?
Fixed Income,"How might changes in monetary policy influence fixed income markets, and what should investors consider in response?"
Fixed Income,How does inflation influence the returns on fixed income investments?
Gold,How do geopolitical tensions and trade wars impact the price of gold and other precious metals?
Gold,What are the potential consequences for the market if Fort Knox's gold reserves were significantly lower than reported?
Gold,"What is the historical correlation between gold prices and the performance of the S&P 500, and how can it be effectively analyzed?"
Gold,"How do varying international policies, like tariffs and trade barriers, influence the global gold market?"
Gold,What are the benefits and risks associated with investing in physical gold vs. gold ETFs and other financial instruments?
Gold,How do central bank activities in bullion acquisition influence global gold prices?
Gold,"How does investing in gold function as a hedge against inflation, especially in uncertain economic times?"
Gold,"What factors contribute to fluctuations in gold and silver prices, and how can investors predict these changes?"
Gold,What are the considerations and challenges involved in rolling over an IRA into a gold-backed retirement account?
Gold,How do the production costs of U.S. coins affect the overall perception of gold as an investment or hedge against inflation?
Hedge Funds,"How can AI solutions optimize hedge fund operations, specifically in areas like fund analysis and financial data processing?"
Hedge Funds,What role can AI copilots play in enhancing the decision-making process for hedge fund managers and individual traders?
Hedge Funds,"What strategies are effective for hedge funds looking to attract investors, and what challenges do they face in securing capital?"
Hedge Funds,"How does leverage work in hedge fund strategies, and what implications does it have for investment risk and return?"
Hedge Funds,"How do hedge funds manage and report risk to clients, and what tools and software are commonly used in risk management?"
Hedge Funds,"How do hedge funds handle compliance and regulatory challenges, and what are the common pitfalls to avoid?"
Hedge Funds,"How do hedge funds use alternative data and technology to gain an edge in investments, and what are the current trends in this area?"
Hedge Funds,"What are the most common reasons hedge funds fail, and how can new funds mitigate these risks during their initial development stages?"
Hedge Funds,"How do hedge funds incorporate advanced technologies, like AI and machine learning, into their trading and operational strategies?"
Hedge Funds,"How do hedge funds measure and manage performance metrics such as Alpha, Beta, and Sharpe Ratio effectively?"
Long-Only Equity,What are the primary advantages and challenges of long-only equity investing?
Long-Only Equity,How can value investing be effectively implemented in a long-only equity strategy?
Long-Only Equity,What role does fundamental analysis play in long-only equity investments?
Long-Only Equity,How can AI and data-driven strategies enhance decision-making in long-only equity funds?
Long-Only Equity,What are effective methods for evaluating the performance of a long-only equity fund?
Long-Only Equity,What is the impact of market volatility on long-only equity strategies?
Long-Only Equity,What are the key factors to consider when analyzing a long-only equity investment strategy?
Long-Only Equity,"How important is geographic diversification in a long-only equity portfolio, particularly in emerging markets?"
Long-Only Equity,What are common challenges faced by long-only equity investors during periods of market volatility?
Long-Only Equity,"How do macroeconomic factors, such as tax policies or industry shifts, influence long-only equity investment strategies?"
Private Credit,What challenges do innovators face when trying to implement AI-driven debt negotiation tools in the credit industry?
Private Credit,"How is digital lending transforming access to credit for micro, small, and medium enterprises (MSMEs)?"
Private Credit,How can machine learning models benefit from structured credit data to improve credit risk assessments?
Private Credit,"What are the potential risks and benefits of using private credit strategies, such as litigation finance, for investment portfolios?"
Private Credit,How does peer-to-peer lending leverage credit reporting to ensure accountability and reduce default risks?
Private Credit,What are the key benefits of transforming legacy credit report data into a JSON format for automated processing?
Private Credit,"How do new regulations, such as those from the CFPB, impact compliance requirements for fintech firms and financial services providers?"
Private Credit,In what ways could fintech solutions use API integration to enhance lending processes and borrower experiences?
Private Credit,How can credit unions use analytics as a service (AaaS) to improve member experiences and strengthen member relationships?
Private Credit,"What are some effective strategies for fraud prevention in high-value wire transfers, especially with the rise of digital banking?"
Private Equity,What are the key factors to consider when determining the optimal pricing structure for private equity services?
Private Equity,What are the most reliable strategies for selecting and partnering with fund allocators in private equity?
Private Equity,What are the advantages and challenges of offshore fund formation in the private equity sector?
Private Equity,What considerations should one have when deciding on the best entity structure to handle private investments for high-net-worth individuals?
Private Equity,How might a private equity investor approach identifying and shorting overvalued asset classes such as multifamily real estate?
Private Equity,"With the current market unpredictability, what investment vehicles are best positioned to offer resilience and growth potential?"
Private Equity,What are the ethical and legal implications of manipulating tariff structures in the private equity and investment sectors?
Private Equity,"How can businesses monetize tax equity effectively, particularly in the solar energy sector?"
Private Equity,What role do educational programs like the 3+2 with Columbia University play in the recruitment process for private equity and investment banking careers?
Private Equity,What are the challenges and opportunities for private equity in the context of economic downturns or recessions?
Stocks,How has AI changed the landscape of stock market research and analysis?
Stocks,What are some best practices for building and testing predictive models for stock price movements?
Stocks,How can individual investors gain access to comprehensive analyst reports typically available only to institutional investors?
Stocks,What strategies can new investors use to manage market volatility and emotional stress associated with investing?
Stocks,How do interest rate changes by the Federal Reserve influence stock market trends and investment decisions?
Stocks,What are the potential implications of market manipulation allegations on investor confidence and market stability?
Stocks,What strategies can investors use to identify and capitalize on undervalued stocks with high growth potential?
Stocks,"What are the risks and benefits of investing in small-cap equities, particularly those in foreign markets, like Chinese stocks?"
Stocks,How can investors determine if the market is oversold or undervalued following a significant market correction?
Stocks,"What role does insider trading activity affect stock prices, and how can it be detected?"
Unknown,How should one decide between continuing with a current internship or accepting a new opportunity?
Unknown,What are the advantages and disadvantages of interning at a national bank compared to a smaller company?
Unknown,How does technological obsolescence in finance and tech sectors affect career progression?
Unknown,"What factors should be considered when evaluating new job offers, especially from lesser-known companies?"
Unknown,What potential career paths can be pursued with a degree in FinTech compared to accounting?
Unknown,"How can external economic factors, like crude oil pricing, influence investment decisions?"
Unknown,"What are the implications of declining birth rates on global economies, especially in rapidly urbanizing countries?"
Unknown,What are the risks and benefits of investing in commodities like crude oil compared to traditional stocks?
Unknown,How can demographic changes in a major economy like China affect global markets and investment strategies?
Unknown,How effective are pro-natalist policies in reversing declining fertility trends?
Venture Capital,What are the key factors venture capitalists consider when evaluating a fintech startup's product-market fit?
Venture Capital,"What are the current trends in venture capital investments in the fintech sector, especially concerning AI and machine learning?"
Venture Capital,How do venture capital firms assess the potential of fintech startups in emerging markets?
Venture Capital,What role do venture capitalists play in the ongoing acquisition trend of fintech companies purchasing traditional banks?
Venture Capital,What are the primary factors venture capitalists consider before investing in a startup?
Venture Capital,How do venture capitalists assess the risks and potential returns of emerging industries such as AI and quantum computing?
Venture Capital,"What strategies do startups use to attract venture capital funding, and how can they improve their chances of securing investment?"
Venture Capital,What are the emerging trends in venture capital investment strategies and focus areas for the next decade?
Venture Capital,How do venture capitalists evaluate the scalability and long-term sustainability of a technology or product?
Venture Capital,"What is the significance of an exit strategy for venture capitalists, and how does it influence their investment decisions?"
