category,questions
Central & Eastern Asia,How is financial technology influencing financial inclusion in Central and Eastern Asia?
Central & Eastern Asia,What are the top challenges fintech companies face when expanding into the Asian market?
Central & Eastern Asia,How do government regulations in Central and Eastern Asia impact the adoption of cryptocurrencies?
Central & Eastern Asia,How are cultural and economic differences affecting the adoption of fintech solutions in different parts of Asia?
Central & Eastern Asia,What are the emerging trends in digital banking that are gaining popularity in Asia?
Central & Eastern Asia,What are the key factors driving economic growth in Central and Eastern Asia?
Central & Eastern Asia,"How do geopolitical tensions, like tariffs and trade wars, affect markets in Central and Eastern Asia?"
Central & Eastern Asia,What impact do China's economic policies have on neighboring countries in Central and Eastern Asia?
Central & Eastern Asia,How do currency fluctuations in Central and Eastern Asia affect global financial markets?
Central & Eastern Asia,How does the trade war influence foreign investment and economic policies in Central and Eastern Asia?
Eastern Europe,"What are the key challenges fintech companies face in Eastern Europe, and how are they addressing regulatory changes?"
Eastern Europe,How does the use of digital banking and fintech services in Eastern Europe compare to Western Europe?
Eastern Europe,What are the implications of geopolitical tensions in Eastern Europe for international investors and businesses?
Eastern Europe,How is the financial regulatory environment evolving in Eastern European countries?
Eastern Europe,What are the common challenges expatriates face when accessing banking services in Eastern European countries?
Eastern Europe,How are Eastern European countries contributing to the global fintech ecosystem?
Eastern Europe,How can investors navigate risks when investing in Eastern European markets?
Eastern Europe,What are the potential impacts of economic sanctions on the economies and markets of Eastern Europe?
Eastern Europe,How does cross-border employment impact financial transactions and banking in Eastern European countries?
Eastern Europe,What are some effective strategies for dealing with a frozen bank account when working abroad in Eastern Europe?
Eastern/Western Africa,What are the primary challenges in establishing an electronic banking and payment gateway system in underserved African markets?
Eastern/Western Africa,How can fintech solutions effectively address the high fees associated with traditional banking in certain African regions?
Eastern/Western Africa,What are the regulatory hurdles to launching financial services such as prepaid card issuance and international IBANs in Africa?
Eastern/Western Africa,How can the integration of electronic banks and payment gateways facilitate economic growth in Eastern and Western Africa?
Eastern/Western Africa,What infrastructure and technological components are crucial for starting a successful fintech platform in Africa?
Eastern/Western Africa,How can digital payment systems enhance financial inclusion in East and West African communities?
Eastern/Western Africa,"What partnerships (e.g., with Visa/Mastercard) are essential for building a sustainable electronic banking service in Africa?"
Eastern/Western Africa,How can fintech companies ensure compliance with global financial standards while operating in African markets?
Eastern/Western Africa,What role do payment gateways play in improving the transactional efficiency for merchants and customers in African regions?
Eastern/Western Africa,In what ways can foreign currencies and multi-currency support benefit local businesses in Africa?
Mexico & Carribean,What are the main regulatory challenges facing fintech companies in Mexico and the Caribbean?
Mexico & Carribean,How do fintech companies in Latin America stay informed about changes in financial regulations?
Mexico & Carribean,What are some effective tools or methods for ensuring compliance in the fintech industry in Mexico?
Mexico & Carribean,How can fintechs in the Caribbean improve their internal audits to meet international standards?
Mexico & Carribean,Are there any exchange-traded funds (ETFs) that closely track the Mexican Peso?
Mexico & Carribean,What are the potential benefits and challenges of pursuing a financial career in the Caribbean region?
Mexico & Carribean,How does the financial market environment in Mexico differ from that of the Caribbean islands?
Mexico & Carribean,What are the best practices for someone planning a career transition from IT to finance within the Latin American market?
Mexico & Carribean,How valuable is a CFA or FMVA certification for professionals aiming to work in investment sectors within Mexico?
Mexico & Carribean,What role does education play in advancing a career in investment banking or private equity in Latin America?
Middle East Asia,What is the impact of AI and fintech innovations on the traditional financial sectors in the Middle East?
Middle East Asia,How does the geopolitical landscape of the Middle East influence international investments in the region?
Middle East Asia,What are the opportunities and challenges for fintech startups looking to expand in the UAE and broader Gulf region?
Middle East Asia,How are oil prices and production policies in GCC countries affecting global energy markets?
Middle East Asia,What are the implications of the UAE's $1.4 trillion investment commitment in the U.S. for both countries' economies and bilateral relations?
Middle East Asia,How can fintech companies benefit from the strategic positioning of cities like Dubai as innovation hubs?
Middle East Asia,What are the potential economic and social impacts of Turkey's current financial situation on the broader Middle East region?
Middle East Asia,How is the integration of Islamic finance principles shaping the real estate investment landscape in the Gulf?
Middle East Asia,What are the current trends and future prospects for the forex trading industry in Middle Eastern financial institutions?
Middle East Asia,How are sovereign wealth funds in the Middle East leveraging their investments to influence global economic trends?
South America,How have fintech companies in South America adapted to the challenges of providing real-time transaction access to users?
South America,"What is the impact of neobanks in South America, and which ones are leading in specific countries?"
South America,"What are the regulatory challenges faced by startups, especially fintech and crypto companies, in countries like Brazil and El Salvador?"
South America,How does the currency conversion rate in Brazil affect startup funding and investment?
South America,What strategies can South American startups use to attract international investors despite geographical and legal challenges?
South America,What are the advantages and disadvantages of traditional banks versus neobanks in South American countries?
South America,How important is it for fintech apps in South America to offer real-time financial data access to consumers?
South America,What role do local financial regulations play in the growth and operation of fintech companies in South America?
South America,How do South American entrepreneurs overcome the stigma of international investment risk due to regional instability?
South America,What innovations are driving the fintech and banking sectors in South America?
South Asia,"What are the key challenges and opportunities for fintech startups in South Asia, especially in relation to digital lending and credit assessments?"
South Asia,How has the introduction of UPI and similar digital payment systems transformed financial transactions in India and South Asia as a whole?
South Asia,What implications does AI-driven lending have for traditional banking institutions in countries like India and Pakistan?
South Asia,How do cultural and economic factors influence the adoption of digital financial services in South Asian countries?
South Asia,What strategies should fintech startups employ to address the financing needs of underbanked populations in South Asia?
South Asia,How can digital platforms ensure security and trust in peer-to-peer lending and digital transactions in countries like India?
South Asia,"How can transparency and fair practices be ensured in the fintech industry, particularly in emerging markets within South Asia?"
South Asia,What role does government policy play in facilitating or hindering the growth of fintech solutions in South Asian economies?
South Asia,What are the most effective ways for fintech incubators in South Asia to partner with established financial institutions such as NBFCs?
South Asia,What are the potential benefits and risks of pursuing advanced fintech education abroad for students from South Asia?
Southeast Asia,What are the advantages and disadvantages of pursuing an MBA in Singapore for career advancement in Fintech?
Southeast Asia,How valuable is diverse experience in startup environments when transitioning to strategic roles at established companies like Visa or Mastercard?
Southeast Asia,What are the prospects for professionals in the Fintech industry attending international conferences such as Money 20/20 in Bangkok?
Southeast Asia,"How can experience in CX design, BizOps, and risk management in startups position someone for a career pivot into strategy and product roles?"
Southeast Asia,What factors should be considered when weighing the cost of conference tickets against potential career networking opportunities in Southeast Asia?
Southeast Asia,How does the financial leveraging strategy in forex trading developed in Singapore compare to traditional investment strategies?
Southeast Asia,What impact do tariffs on Vietnamese exports have on investment strategies and options trading?
Southeast Asia,How do the roles and experiences in early-stage startup environments contribute to problem-solving and technical proficiency in the Fintech sector?
Southeast Asia,What are the key considerations for someone transitioning from a crypto-banking role to a more traditional financial operations position?
Southeast Asia,How can one effectively showcase a track record of investment returns to attract attention from hedge funds or investor groups in Southeast Asia?
Southern Africa,"What are the main financial challenges faced by consumers in Southern Africa, and how are fintech startups addressing them?"
Southern Africa,How has M-Pesa influenced the financial services landscape in Southern Africa?
Southern Africa,How can fintech solutions improve the management of mobile payment systems in regions like Southern Africa?
Southern Africa,What role does digital payment innovation play in enhancing financial inclusion in Southern Africa?
Southern Africa,"In what ways can new fintech applications, such as a payment scheduling app for M-Pesa, improve user experience and efficiency?"
Southern Africa,How do social and economic factors in Southern Africa impact the growth and success of fintech startups?
Southern Africa,What challenges do startups face when implementing bulk payment solutions in Southern African markets?
Southern Africa,"How can technology support community initiatives and empowerment projects, such as programs for children through sports in Southern Africa?"
Southern Africa,What are the key considerations in developing fintech solutions that cater to the specific needs of Southern African markets?
Southern Africa,What are the advantages and disadvantages of having a high number of fintech startups in countries like Kenya?
U.S and Canada,How do U.S. and Canadian fintech companies approach data privacy and protection differently?
U.S and Canada,What are the differences and similarities in the fintech regulatory environments between the U.S. and Canada?
U.S and Canada,How can fintech startups successfully find and partner with banks in the U.S. and Canada?
U.S and Canada,How do fintech solutions play in transforming the hotel industry’s accounts payable systems?
U.S and Canada,How can fintech platforms effectively handle compliance with differing financial regulations in the US and Canada?
U.S and Canada,How can blockchain and decentralized technologies provide more inclusive and accessible credit systems for unbanked or underbanked populations?
U.S and Canada,"What are the challenges and opportunities faced by U.S. citizens wanting to establish financial businesses, such as hedge funds, in Canada?"
U.S and Canada,How can fintech solutions that focus on green finance or sustainable investments drive changes in the financial markets in North America?
U.S and Canada,How does the regulatory environment impact hedge fund operations differently in the U.S. versus Canada?
U.S and Canada,What are the potential long-term economic impacts of trade tensions between the U.S. and Canada?
Unknown,What factors should be considered when determining the optimal pricing margin for a service-based business?
Unknown,"How can online platforms for business formation be evaluated for reliability and cost-effectiveness, particularly for offshore registrations?"
Unknown,What are some recommended alternatives to Yahoo Finance for tracking real-time stock prices and market news on mobile apps?
Unknown,How should investors decide when to re-enter the market if they have moved their investments to cash?
Unknown,What indicators are most commonly used by investors to signal when to open new positions in the stock market?
Unknown,"Can you recommend books that provide a comprehensive understanding of hedge funds, either from a historical or practical perspective?"
Unknown,What role does crisis management play in determining pricing strategies for businesses?
Unknown,"What attributes are essential for an investment website or app that tracks financial markets, especially for real-time data and compatibility with data export formats?"
Unknown,How do personal life events and changes in risk tolerance impact investment strategies and market participation decisions?
Unknown,"What are key considerations in choosing between different online business formation sites for offshore locations such as BVI, Cayman, and Bermuda?"
Western Europe,"What are the major economic challenges facing Western European countries today, and how are governments addressing them?"
Western Europe,"How is the energy transition affecting Western European economies, and what investments are being made in renewable energy?"
Western Europe,How is the rise of technology and digital transformation impacting traditional industries in Western Europe?
Western Europe,"What are the key factors driving investment trends in Western Europe, particularly in the hedge fund and private equity sectors?"
Western Europe,How are demographic changes in Western Europe influencing economic policies and labor markets in the region?
Western Europe,"What strategies are Western European countries employing to recover from economic downturns, and what role does foreign investment play?"
Western Europe,"What role does AI play in the fintech industry in Western Europe, particularly in enhancing the software development process and improving financial services?"
Western Europe,"How have recent geopolitical events impacted currency stability in Western Europe, specifically the Euro and the Swiss Franc?"
Western Europe,"How is the payment gateway landscape evolving in Western Europe, and what are the key innovations driving this change?"
Western Europe,How do mergers and acquisitions influence the valuation of companies in Western Europe?
